date,status,speaker,title,url,last_checked,language,type
2020-03-08,Success,Theo. Ovid,"Prepare Yourself For The Battle - Pastor Theo. Ovid, Headstone Tabernacle",https://www.youtube.com/watch?v=SUXvZkpXztI,2025-12-23,English,Full Sermon
2020-03-04,Success,Isaac Ovid Headstone Tabernacle,Making Preparations For The Coming Of The Lord - Bro. Isaac Ovid Headstone Tabernacle,https://www.youtube.com/watch?v=Z4g1hYEbvgU,2025-12-23,English,Full Sermon
2020-03-01,No Transcript,Unknown Speaker,"The Pillar of Fire - Bro. Anthony O'Brien, Headstone Tabernacle",https://www.youtube.com/watch?v=HdeoEPuohAE,2025-12-23,Unknown,Full Sermon
2020-02-26,Success,Theo Ovid,When You Stand Praying Forgive - Pastor Theo Ovid,https://www.youtube.com/watch?v=XZX1ZWc41hE,2025-12-23,English,Full Sermon
2020-02-23,Success,Isaac Ovid,The Restored Faith Unlocks The Fullness Of The Transforming Power - Bro. Isaac Ovid,https://www.youtube.com/watch?v=UNw39yhtN6A,2025-12-23,English,Full Sermon
2020-02-19,Success,Theo Ovid,"Bride Material, Wise Virgins - Pastor Theo Ovid",https://www.youtube.com/watch?v=TI4CYxgeEi0,2025-12-23,English,Full Sermon
2020-02-16,Success,Theo. Ovid,"Seal Those That Sigh And Cry - Pastor Theo. Ovid, Headstone Tabernacle",https://www.youtube.com/watch?v=OPvkZysysN8,2025-12-23,English,Full Sermon
2020-02-12,Success,Theo Ovid,The Angel From The East - Pastor Theo Ovid,https://www.youtube.com/watch?v=Kz-Mu4IsF48,2025-12-23,English,Full Sermon
2020-02-09,Success,Theo Ovid,"Called Back To The Original Faith, The Bride - Pastor Theo Ovid, Headstone Tabernacle",https://www.youtube.com/watch?v=O_t3H0XQhEM,2025-12-23,English,Full Sermon
2020-02-05,Success,Unknown Speaker,"If You Love Me - Pastor. Theo Ovid, Headstone Tabernacle",https://www.youtube.com/watch?v=rPQE1nAg6eQ,2025-12-23,English,Full Sermon
2020-01-26,Success,Theo. Ovid,"The Faith That Once Was Delivered To The Saints - Pastor Theo. Ovid, Headstone Tabernacle",https://www.youtube.com/watch?v=moP9nuKvCgE,2025-12-23,English,Full Sermon
2020-01-22,Success,Theo Ovid,The Escaped Ones - Pastor Theo Ovid - Headstone Tabernacle,https://www.youtube.com/watch?v=zqxvEMN581w,2025-12-23,English,Full Sermon
2020-01-19,Success,Theo Ovid,"The Faith Of the Fathers - Pastor Theo Ovid, Headstone Tabernacle",https://www.youtube.com/watch?v=q06Hl0nNdoQ,2025-12-23,English,Full Sermon
2020-01-12,Success,Theo Ovid,"Returning To The Ancient Landmark That The Fathers Have Set - Pastor Theo Ovid, Headstone Tabernacle",https://www.youtube.com/watch?v=kaD2lqnpowE,2025-12-23,English,Full Sermon
2020-01-05,Success,Theo Ovid,"The Time Is At Hand - Pastor Theo Ovid, Headstone Tabernacle",https://www.youtube.com/watch?v=enIkq346RXI,2025-12-23,English,Full Sermon
2019-12-29,Success,Unknown Speaker,God Is Obligated To Meet You On The Basis Of His Promised Word - Bro. Anthony O'Brien,https://www.youtube.com/watch?v=N9IKw6JFg6A,2025-12-23,English,Full Sermon
2019-12-22,Success,Theo Ovid,"Faith Is The Victory That Overcomes The World - Pastor Theo Ovid, Headstone Tabernacle",https://www.youtube.com/watch?v=1zq1RVLHWMs,2025-12-23,English,Full Sermon
2019-12-18,Success,Theo Ovid,Out Of Weakness They Were Made Strong - Pastor Theo Ovid,https://www.youtube.com/watch?v=ZDwg-U5CqJA,2025-12-23,English,Full Sermon
2019-12-01,Success,Pastor. Theo Ovid,"Calvary, Where Fallen Man Regained Full Access To The Inheritance That Adam Lost - Pastor. Theo Ovid",https://www.youtube.com/watch?v=O5k4SUYf_Cs,2025-12-23,English,Full Sermon
2019-11-27,Success,Theo Ovid,The Restoration of Access To Authority And Power By The Sons Of God - Pastor Theo Ovid,https://www.youtube.com/watch?v=PHReZhvOr98,2025-12-23,English,Full Sermon
2019-11-20,Success,Theo Ovid,"Perseverance - Bro. Theo Ovid, Headstone Tabernacle",https://www.youtube.com/watch?v=aMHmhYGrGxs,2025-12-23,English,Full Sermon
2019-11-17,Success,Isaac Ovid,"He That Overcometh Shall Inherit All Things -  Bro. Isaac Ovid, Headstone Tabernacle",https://www.youtube.com/watch?v=G2BYN0iHqf8,2025-12-23,English,Full Sermon
2019-11-13,Success,Theo Ovid,Process - Pastor Theo Ovid,https://www.youtube.com/watch?v=widOI48VPfg,2025-12-23,English,Full Sermon
2019-11-10,Success,Theo Ovid,"The Lord Looks At The Heart - Bro. Theo Ovid, Headstone Tabernacle",https://www.youtube.com/watch?v=-9LyRRKwFpA,2025-12-23,English,Full Sermon
2019-11-06,Success,Theo Ovid Headstone Tabernacle,As It Was In My Heart - Pastor Theo Ovid Headstone Tabernacle,https://www.youtube.com/watch?v=si9etJNkIdg,2025-12-23,English,Full Sermon
2019-11-03,Success,Theo Ovid,"Four Groups, Which One? - Bro. Theo Ovid, Headstone Tabernacle.",https://www.youtube.com/watch?v=7FaT_-eG1mI,2025-12-23,English,Full Sermon
2019-10-30,Success,Unknown Speaker,Headstone Tabernacle Live Stream,https://www.youtube.com/watch?v=W0y94cd8xRY,2025-12-23,English,Full Sermon
2019-10-27,Success,Unknown Speaker,"The True Seed Of The Word - Bro. Anthony O'Brien, Headstone Tabernacle",https://www.youtube.com/watch?v=SDgnHhfrxys,2025-12-23,English,Full Sermon
2019-10-23,Success,Unknown Speaker,Headstone Tabernacle Live Stream,https://www.youtube.com/watch?v=D82ZBX2cOrk,2025-12-23,English,Full Sermon
2019-10-23,Success,Unknown Speaker,Headstone Tabernacle Live Stream,https://www.youtube.com/watch?v=0m4pQ_91A7g,2025-12-23,English,Full Sermon
2019-10-20,Success,Theo Ovid,"The Day Of The Lord - Bro. Theo Ovid, Headstone Tabernacle",https://www.youtube.com/watch?v=18AurB2yQxA,2025-12-23,English,Full Sermon
2019-10-16,Success,Unknown Speaker,Headstone Tabernacle Live Stream,https://www.youtube.com/watch?v=d3IXpveE3iw,2025-12-23,English,Full Sermon
2019-10-13,No Transcript,Isaac Ovid,"Salvation, Redemption, Adoption & Perfection - Bro. Isaac Ovid, Headstone Tabernacle",https://www.youtube.com/watch?v=0lpFuBYjmMc,2025-12-23,Unknown,Full Sermon
2019-10-09,Success,Isaac Ovid,"The Manifestation of the Nature Of God in The Bride - Bro. Isaac Ovid, Headstone Tabernacle",https://www.youtube.com/watch?v=93aMqORpfp4,2025-12-23,English,Full Sermon
2019-10-06,No Transcript,Olu Omotoyinbo AM,Thinking Differently - Bro. Olu Omotoyinbo AM,https://www.youtube.com/watch?v=UnZe3Kk9fDE,2025-12-23,Unknown,Full Sermon
2019-10-02,Success,Theo Ovid,"In The Beginning Was The Word - Pastor Theo Ovid, Headstone Tabernacle",https://www.youtube.com/watch?v=hPymCU5pTqQ,2025-12-23,English,Full Sermon
2019-09-29,Success,Theo Ovid,"If Any Man Thirst - Bro. Theo Ovid, Headstone Tabernacle",https://www.youtube.com/watch?v=-3zFWvTxj7I,2025-12-23,English,Full Sermon
2019-09-18,Success,Theo Ovid Headstone Tabernacle,"Thy Light And Thy Truth, Let Them Lead Me - Bro. Theo Ovid  Headstone Tabernacle",https://www.youtube.com/watch?v=E6MRElp9KnY,2025-12-23,English,Full Sermon
2019-09-15,Success,Theo Ovid,"Who Shall Ascend Into The Hill Of The Lord? - Bro. Theo Ovid, Headstone Tabernacle",https://www.youtube.com/watch?v=UAqrFOkBpmI,2025-12-23,English,Full Sermon
2019-09-11,Success,Theo Ovid Headstone Tabernacle,Predestinated According To Foreknowledge - Pastor Theo Ovid Headstone Tabernacle,https://www.youtube.com/watch?v=9mWEy2X55lA,2025-12-23,English,Full Sermon
2019-09-08,Success,Isaac Ovid,"When You Look What Do You See? - Bro. Isaac Ovid, Headstone Tabernacle",https://www.youtube.com/watch?v=VONdzNcDB70,2025-12-23,English,Full Sermon
2019-09-04,Success,Theo Ovid Headstone Tabernacle,"Four Groups, Which One? -Pastor Theo Ovid Headstone Tabernacle",https://www.youtube.com/watch?v=VuvFxXJZ5h4,2025-12-23,English,Full Sermon
2019-09-01,Success,Raymond Thompson,I Was Glad When They Said Let Us Go Into The House Of The Lord - Bro. Raymond Thompson,https://www.youtube.com/watch?v=CZ2tzmqCFsg,2025-12-23,English,Full Sermon
2019-08-28,Success,Unknown Speaker,Headstone Tabernacle Live Stream,https://www.youtube.com/watch?v=wMIa7R5xD60,2025-12-23,English,Full Sermon
2019-08-25,No Transcript,Raymond Thompson,"Coming To Church - Bro. Raymond Thompson, ETMB Tabernacle",https://www.youtube.com/watch?v=rLzYt-A3rVE,2025-12-23,Unknown,Full Sermon
2019-08-21,Success,Unknown Speaker,Headstone Tabernacle Live Stream,https://www.youtube.com/watch?v=jZfj72cRjqg,2025-12-23,English,Full Sermon
2019-08-18,Success,Stephen Ollivierie,"The Presence Of God - Bro. Stephen Ollivierie, Headstone Tabernacle",https://www.youtube.com/watch?v=Wa9Llh4AMa4,2025-12-23,English,Full Sermon
2019-08-14,Success,Unknown Speaker,"If You Shall Say - Bro. Anthony O'Brien, Headstone Tabernacle",https://www.youtube.com/watch?v=wet7g0se03s,2025-12-23,English,Full Sermon
2019-08-11,Success,Unknown Speaker,"Your Names Are Written In Heaven - Bro. Anthony O'Brien, Headstone Tabernacle",https://www.youtube.com/watch?v=nL8EdL5C3UY,2025-12-23,English,Full Sermon
2019-08-07,Success,Unknown Speaker,"As Many As Received Him- Bro. Anthony O'Brien, Headstone Tabernacle",https://www.youtube.com/watch?v=i1_SWVDtkV4,2025-12-23,English,Full Sermon
2019-08-04,Success,Theo Ovid,"There Is A River - Pastor Theo Ovid, Headstone Tabernacle",https://www.youtube.com/watch?v=CXeTLBvuktQ,2025-12-23,English,Full Sermon
2019-07-31,Success,Theo Ovid,"In His Presence - Pastor Theo Ovid, Headstone Tabernacle",https://www.youtube.com/watch?v=KvSavzzSmsk,2025-12-23,English,Full Sermon
2019-07-28,Success,Isaac Ovid,"The Greatest Connection  - Bro. Isaac Ovid, Headstone Tabernacle",https://www.youtube.com/watch?v=82baLWPFRE0,2025-12-23,English,Full Sermon
2019-07-24,Success,Theo Ovid Headstone Tabernacle,Ripened Seeds- Pastor Theo Ovid Headstone Tabernacle,https://www.youtube.com/watch?v=3qDzJOiFfFQ,2025-12-23,English,Full Sermon
2019-07-21,Success,Theo Ovid,"Reproducing The Original Grain Again - Bro. Theo Ovid, Headstone Tabernacle",https://www.youtube.com/watch?v=hpplec8FKfI,2025-12-23,English,Full Sermon
2019-07-17,Success,Unknown Speaker,Every Seed After Its Own Kind - Bro. Anthony O'Brien Headstone Tabernacle,https://www.youtube.com/watch?v=ubGPbc3yNFw,2025-12-23,English,Full Sermon
2019-07-14,Success,Isaac Ovid,"Unified By  The Word - Bro. Isaac Ovid, Headstone Tabernacle",https://www.youtube.com/watch?v=vID3B8rTIF8,2025-12-23,English,Full Sermon
2019-07-07,No Transcript,Raymond Thompson,"Prepared Ground For The Harvest - Pastor Raymond Thompson, Headstone Tabernacle",https://www.youtube.com/watch?v=gX21t_eqxTg,2025-12-23,Unknown,Full Sermon
2019-07-07,Success,Olu Omotoyinbo,"The Story Of Us - Pastor Olu Omotoyinbo, Headstone Tabernacle",https://www.youtube.com/watch?v=whdGzuAWIHU,2025-12-23,English,Full Sermon
2019-07-06,No Transcript,Isaac Ovid,"The Laws Of The Harvest - Bro. Isaac Ovid, Headstone Tabernacle",https://www.youtube.com/watch?v=DIZB2KWfRrQ,2025-12-23,Unknown,Full Sermon
Unknown Date,No Transcript,Paul Onanjeka,The Holy Spirit Himself  Is Come In His Fullness For A Birth And Adoption -Pastor Paul Onanjeka,https://www.youtube.com/watch?v=5Fswy1WOJGg,2025-12-23,Unknown,Full Sermon
2019-07-06,Success,Solomon Nachina,"The Manifestation Is The Interpretation - Pastor Solomon Nachina, Headstone Tabernacle",https://www.youtube.com/watch?v=mZHdqcyIUXs,2025-12-23,English,Full Sermon
2019-07-05,Success,Unknown Speaker,The Seed In The Sun - Pastor. Peter Chandler Headstone Tabernacle,https://www.youtube.com/watch?v=LS4WsHI4fKg,2025-12-23,English,Full Sermon
2019-06-30,Success,Solomon Nachina,"That Which Is Perfect Is Come - Pastor Solomon Nachina, Ghana",https://www.youtube.com/watch?v=LukLFZXeax0,2025-12-23,English,Full Sermon
2019-06-26,Success,Unknown Speaker,Headstone Tabernacle Live Stream,https://www.youtube.com/watch?v=z0MhhB0XiPE,2025-12-23,English,Full Sermon
2019-06-23,Success,Theo Ovid,"They That Sow In Tears Shall Reap In Joy  - Bro. Theo Ovid, Headstone Tabernaclell",https://www.youtube.com/watch?v=lkH1thzmv2I,2025-12-23,English,Full Sermon
2019-06-16,Success,Theo Ovid,"The True Gospel Trumpet Gives A Certain Sound - Bro. Theo Ovid, Headstone Tabernacle",https://www.youtube.com/watch?v=yn17tNA8mxU,2025-12-23,English,Full Sermon
2019-06-12,Success,Theo Ovid,"Blow A Trumpet, Sound An Alarm - Pastor Theo Ovid, Headstone Tabernacle",https://www.youtube.com/watch?v=sQj4TGwVB8E,2025-12-23,English,Full Sermon
2019-06-09,Success,Unknown Speaker,"The Trumpet Of The Jubilee - Pastor. Theo Ovid, Headstone Tabernacle",https://www.youtube.com/watch?v=smyt8ykiG-4,2025-12-23,English,Full Sermon
2019-06-06,Success,Theo Ovid Headstone Tabernacle,Seal Not The Sayings Of The Prophecy - Pastor Theo Ovid Headstone Tabernacle,https://www.youtube.com/watch?v=a7hSSc1Hojc,2025-12-23,English,Full Sermon
2019-06-02,Success,Theo Ovid,"Another Year Of Jubilee Then Judgment - Pastor Theo Ovid, Headstone Tabernacle",https://www.youtube.com/watch?v=AFdCl_sDkOw,2025-12-23,English,Full Sermon
2019-05-29,No Transcript,Isaac Ovid,"Lot And His Wife - Bro. Isaac Ovid, Headstone Tabernacle",https://www.youtube.com/watch?v=KBcrttpVjZk,2025-12-23,Unknown,Full Sermon
2019-05-26,Success,Unknown Speaker,"The Ministry Of The Morning Star - Bro. Anthony O'Brien, Headstone Tabernacle",https://www.youtube.com/watch?v=2G6FgPUpvzA,2025-12-23,English,Full Sermon
2019-05-22,Success,Unknown Speaker,Headstone Tabernacle Live Stream,https://www.youtube.com/watch?v=uaHx4L4w_hU,2025-12-23,English,Full Sermon
2019-05-19,Success,Isaac Ovid,"My Word Shall Not Return Void - Bro. Isaac Ovid, Headstone Tabernacle",https://www.youtube.com/watch?v=NAaWV00kXHw,2025-12-23,English,Full Sermon
2019-05-15,Success,Unknown Speaker,Headstone Tabernacle Live Stream,https://www.youtube.com/watch?v=ptOKB8b8uMQ,2025-12-23,English,Full Sermon
2019-05-12,Success,Seven Lived Voices,"Seven Lived Voices - Pastor. Theo Ovid, HeadstoneTabernacle",https://www.youtube.com/watch?v=bXjWUbWzN2s,2025-12-23,English,Full Sermon
2019-05-08,Success,Theo Ovid,"A Prisoner Of Jesus Christ - Pastor Theo Ovid, Headstone Tabernacle",https://www.youtube.com/watch?v=F7FueHH_xtI,2025-12-23,English,Full Sermon
2019-05-05,Success,Theo Ovid,"I Am Set For A Defense Of The Gospel Of Jesus Christ - Pastor Theo Ovid, Headstone Tabernacle",https://www.youtube.com/watch?v=E5rGiKXpzmw,2025-12-23,English,Full Sermon
2019-05-01,Success,Unknown Speaker,Headstone Tabernacle Live Stream,https://www.youtube.com/watch?v=Q3xuTDRmtH0,2025-12-23,English,Full Sermon
2019-04-29,No Transcript,Unknown Speaker,Funeral Service of Brother Bobby Rajkumar,https://www.youtube.com/watch?v=rgiz6zunBzg,2025-12-23,Unknown,Memorial Service
2019-04-28,No Transcript,Isaac Ovid,"The Truth Will Make You Free - Bro. Isaac Ovid, Headstone Tabernacle",https://www.youtube.com/watch?v=W5ZIXGj6rk8,2025-12-23,Unknown,Full Sermon
2019-04-21,No Transcript,Unknown Speaker,Living In The land - Our Inheritance - Pastor Norris Cummings,https://www.youtube.com/watch?v=uYsgYbQhV0o,2025-12-23,Unknown,Full Sermon
2019-04-19,Success,Our Inheritance,"Our Inheritance - Bro. Anthony O'Brien, Headstone Tabernacle",https://www.youtube.com/watch?v=yA_cTMdTppI,2025-12-23,English,Full Sermon
2019-04-14,No Transcript,Isaac Ovid,"Walking In The Way Of The Voice - Bro. Isaac Ovid, Headstone Tabernacle",https://www.youtube.com/watch?v=5apO8IjayOY,2025-12-23,Unknown,Full Sermon
2019-04-07,Success,Trust In The Lord,"Trust In The Lord - Bro. Anthony O'Brien, Headstone Tabernacle",https://www.youtube.com/watch?v=SlSBSOYmCuk,2025-12-23,English,Full Sermon
2019-04-03,Success,Unknown Speaker,"Another Book Of Acts - Bro. Anthony O'Brien, Headstone Tabernacle",https://www.youtube.com/watch?v=A81qr97mwRk,2025-12-23,English,Full Sermon
2019-03-31,Success,Isaac Ovid,"Woe Is Me! For I Am Undone - Bro. Isaac Ovid, Headstone Tabernacle",https://www.youtube.com/watch?v=UcHjF0lzWx8,2025-12-23,English,Full Sermon
2019-03-27,Success,Theo Ovid,"You Are The Branches - Pastor Theo Ovid, Headstone Tabernacle",https://www.youtube.com/watch?v=g4izhfzzUAc,2025-12-23,English,Full Sermon
2019-03-24,No Transcript,Theo Ovid,"One Soweth, Another Watereth, But God Gives The Increase -  Pastor Theo Ovid, Headstone Tabernacle",https://www.youtube.com/watch?v=jZBapBtx6Rs,2025-12-23,Unknown,Full Sermon
2019-03-20,No Transcript,Theo Ovid,Vessels Sanctified Fit And Ready For The Master's Good Use- Pastor Theo Ovid -Headstone Tabernacle,https://www.youtube.com/watch?v=6pLXInmQAx8,2025-12-23,Unknown,Full Sermon
2019-03-17,No Transcript,Theo Ovid,"From Jacob To Joseph, Jacob Grace Joseph Perfection - Pastor Theo Ovid, Headstone tabernacle",https://www.youtube.com/watch?v=MBai-xIedzI,2025-12-23,Unknown,Full Sermon
2019-03-13,Success,Theo Ovid,Five Wise Virgins - Pastor Theo Ovid -Headstone Tabernacle,https://www.youtube.com/watch?v=nqTMNiqSw40,2025-12-23,English,Full Sermon
2019-03-10,No Transcript,Theo Ovid,"Fight For The Birthright - Pastor Theo Ovid, Headstone Tabernacle",https://www.youtube.com/watch?v=80l5YH9rijU,2025-12-23,Unknown,Full Sermon
2019-02-24,Success,Unknown Speaker,"The Dynamics Of This Church - Bro. Anthony O'Brien, Headstone Tabernacle",https://www.youtube.com/watch?v=-Jkni-f_kK8,2025-12-23,English,Full Sermon
2019-02-20,Success,Unknown Speaker,Headstone Tabernacle Live Stream,https://www.youtube.com/watch?v=PdROvrKvjHw,2025-12-23,English,Full Sermon
2019-02-17,Success,Isaac Ovid,Have You Received The Holy Ghost Since You Believed? - Bro. Isaac Ovid,https://www.youtube.com/watch?v=BKTpKQ6M6KA,2025-12-23,English,Full Sermon
2019-02-13,Success,Unknown Speaker,Headstone Tabernacle Live Stream,https://www.youtube.com/watch?v=ORRz8uU20qI,2025-12-23,English,Full Sermon
2019-02-10,Success,Pastor. Theo Ovid,Blessed Are They That Hunger And Thirst After Righteousness - Pastor. Theo Ovid,https://www.youtube.com/watch?v=bFMzY-1wHVc,2025-12-23,English,Full Sermon
2019-02-06,Success,Theo Ovid,"The Inkhorn Writer - Pastor Theo Ovid, Headstone Tabernacle",https://www.youtube.com/watch?v=t8R5q8MBEpM,2025-12-23,English,Full Sermon
2019-02-03,Success,Theo Ovid,"Ye Shall Be Witnesses Unto Me - Pastor Theo Ovid, Headstone Tabernacle",https://www.youtube.com/watch?v=WSRQ3matJrs,2025-12-23,English,Full Sermon
2019-01-30,Success,Theo Ovid,"I Will Pour Out My Spirit  - Pastor Theo Ovid, Headstone Tabernacle",https://www.youtube.com/watch?v=TNumXQq7BQ8,2025-12-23,English,Full Sermon
2019-01-27,Success,Unknown Speaker,"The Last Great Kill - Bro. Anthony O'Brien, Headstone Tabernacle",https://www.youtube.com/watch?v=kRuRe0kgeOQ,2025-12-23,English,Full Sermon
2019-01-23,Success,Unknown Speaker,Headstone Tabernacle Live Stream,https://www.youtube.com/watch?v=WfHRSyTd5ck,2025-12-23,English,Full Sermon
2019-01-06,Success,Theo Ovid,"The Last Message, The Last Commission, The Last Name. - Pastor Theo Ovid, Headstone Tabernacle",https://www.youtube.com/watch?v=0Tpnt0P9klM,2025-12-23,English,Full Sermon
2018-12-31,Success,Unknown Speaker,Headstone Tabernacle Old Year's Night Service,https://www.youtube.com/watch?v=sAxVcwb8SDY,2025-12-23,English,Full Sermon
2018-12-30,Success,Isaac Ovid,"Spiritual Leadership - Bro. Isaac Ovid, Headstone Tabernacle",https://www.youtube.com/watch?v=yt4ZKc-C344,2025-12-23,English,Full Sermon
2018-12-23,Success,Theo Ovid,"Unity Of The Original Faith Restored By Malachi 4  - Pastor Theo Ovid, South Africa",https://www.youtube.com/watch?v=sX_bj05H4Gk,2025-12-23,English,Full Sermon
2018-12-12,Success,Unknown Speaker,Headstone Tabernacle Live Stream,https://www.youtube.com/watch?v=L0h29j6x0as,2025-12-23,English,Full Sermon
2018-12-12,Success,Unknown Speaker,Headstone Tabernacle Live Stream,https://www.youtube.com/watch?v=q_FdMZHguxc,2025-12-23,English,Full Sermon
2018-12-05,Success,Unknown Speaker,Headstone Tabernacle Live Stream,https://www.youtube.com/watch?v=BVXNpvcnUts,2025-12-23,English,Full Sermon
2018-12-05,Success,Unknown Speaker,Headstone Tabernacle Live Stream,https://www.youtube.com/watch?v=6zg3ENfLaa8,2025-12-23,English,Full Sermon
2018-12-02,No Transcript,Theo Ovid,"The Seventh Seal Of Redemption Produces Another Ephesians - Pastor Theo Ovid, Argentina",https://www.youtube.com/watch?v=1NWMrjuU0Zo,2025-12-23,Unknown,Full Sermon
2018-11-28,Success,Theo Ovid,"The Last Name On The Book - Pastor Theo Ovid, Headstone Tabernacle",https://www.youtube.com/watch?v=jaVhIaDE1So,2025-12-23,English,Full Sermon
2018-11-25,No Transcript,Spiritual Joshuas,"Spiritual Joshuas - Bro. Anthony O'Brien, Headstone Tabernacle",https://www.youtube.com/watch?v=_qqhXh--9eo,2025-12-23,Unknown,Full Sermon
2018-11-21,Success,Unknown Speaker,Headstone Tabernacle Live Stream,https://www.youtube.com/watch?v=oaAPEx1Fgno,2025-12-23,English,Full Sermon
2018-11-18,Success,Theo Ovid,"Ephesians Is The Bridge To Glory Land - Pastor Theo Ovid, Headstone Tabernacle",https://www.youtube.com/watch?v=TqUg8sfeTi0,2025-12-23,English,Full Sermon
2018-11-14,Success,Theo Ovid,"Return to Another Ephesians - Pastor Theo Ovid, Headstone Tabernacle",https://www.youtube.com/watch?v=VI3gRemDEBM,2025-12-23,English,Full Sermon
2018-11-11,Success,Unknown Speaker,"Anointed With God (B) - Pastor. Theo Ovid, Headstone Tabernacle",https://www.youtube.com/watch?v=SaQD_yFkTT0,2025-12-23,English,Full Sermon
2018-11-11,Success,Unknown Speaker,"Anointed With God (A)- Pastor. Theo Ovid, Headstone Tabernacle",https://www.youtube.com/watch?v=ZH-5YlHYAOA,2025-12-23,English,Full Sermon
2018-11-10,Success,Unknown Speaker,"Praise And Worship Service - November 10th, Headstone Tabernacle",https://www.youtube.com/watch?v=e2LyKr37G7o,2025-12-23,English,Worship Service
2018-11-07,Success,Theo Ovid,"Return To Your First Love - Pastor Theo Ovid, Headstone Tabernacle",https://www.youtube.com/watch?v=_7ch2AqQOHM,2025-12-23,English,Full Sermon
2018-11-04,No Transcript,Unknown Speaker,The Troubling Of The Waters - Pastor Norris Cummings,https://www.youtube.com/watch?v=KVanpWwGua4,2025-12-23,Unknown,Full Sermon
2018-10-31,Success,Unknown Speaker,Headstone Tabernacle Live Stream,https://www.youtube.com/watch?v=5s_ljqQyUVY,2025-12-23,English,Full Sermon
2018-10-28,Success,Unknown Speaker,Headstone Tabernacle Live Stream,https://www.youtube.com/watch?v=P6xic-XWBBM,2025-12-23,English,Full Sermon
2018-10-25,Success,Unknown Speaker,Headstone Tabernacle Live Stream,https://www.youtube.com/watch?v=VUehj4yKQBg,2025-12-23,English,Full Sermon
2018-10-21,Success,Theo Ovid,"The Vision Is Yet For An appointed Time - Rev. Theo Ovid, Enugu, Nigeria",https://www.youtube.com/watch?v=-nMHaJ4xsPI,2025-12-23,English,Full Sermon
2018-10-17,Success,Theo Ovid,"The Renewing Of Your Mind - Bro. Theo Ovid, Headstone Tabernacle",https://www.youtube.com/watch?v=BwgRefczzfQ,2025-12-23,English,Full Sermon
2018-10-14,Success,Isaac Ovid,"Knowledge, Understanding & Wisdom - Part 2 - Bro. Isaac Ovid, Headstone Tabernacle",https://www.youtube.com/watch?v=Uu1BfyjHom4,2025-12-23,English,Full Sermon
2018-10-12,Success,Theo Ovid,"Fight For Every Inch - Bro. Theo Ovid, Headstone Tabernacle",https://www.youtube.com/watch?v=5Cz-TXsFBUE,2025-12-23,English,Full Sermon
2018-10-10,Success,Unknown Speaker,Headstone Tabernacle Live Stream,https://www.youtube.com/watch?v=d3WGNFr81Es,2025-12-23,English,Full Sermon
2018-10-07,Success,Isaac Ovid,"Knowledge, Understanding & Wisdom - Part I - Bro. Isaac Ovid, Headstone Tabernacle",https://www.youtube.com/watch?v=PLFCq-k5Ly4,2025-12-23,English,Full Sermon
2018-10-03,Success,Unknown Speaker,"The Trial Of Your Faith - Bro. Anthony O'Brien, Headstone Tabernacle",https://www.youtube.com/watch?v=SjIv_gbRxw0,2025-12-23,English,Full Sermon
2018-09-30,No Transcript,Theo Ovid,"Faith In The Call Of God - Bro. Theo Ovid, Headstone Tabernacle",https://www.youtube.com/watch?v=x8yd1EiF9Pg,2025-12-23,Unknown,Full Sermon
2018-09-28,Success,Theo Ovid,The Action Of Faith - Bro. Theo Ovid,https://www.youtube.com/watch?v=sQk8kAmn0-0,2025-12-23,English,Full Sermon
2018-09-26,Success,Theo Ovid,"Hearing, Receiving And Acting On The Word - Bro. Theo Ovid, Headstone Tabernacle",https://www.youtube.com/watch?v=opPTJjFT10k,2025-12-23,English,Full Sermon
2018-09-19,Success,Theo Ovid,"He That Hath An Ear Let Him Hear - Bro. Theo Ovid, Headstone Tabernacle",https://www.youtube.com/watch?v=5LrAkzy4--4,2025-12-23,English,Full Sermon
2018-09-16,Success,Isaac Ovid,"The Reward Of The Overcomers - Bro. Isaac Ovid, Headstone Tabernacle",https://www.youtube.com/watch?v=sHvs-pRvxJY,2025-12-23,English,Full Sermon
2018-09-12,Success,Theo Ovid,"It’s The Attitude That Brings The Results - Bro. Theo Ovid, Headstone Tabernacle",https://www.youtube.com/watch?v=aLPj-oREE5E,2025-12-23,English,Full Sermon
2018-09-09,Success,Raymond Thompson,"Walking With God - Rev. Raymond Thompson, Enugu, Nigeria",https://www.youtube.com/watch?v=1njBs-FJf5s,2025-12-23,English,Full Sermon
2018-09-05,Success,Theo Ovid,"Blessed Is The Man Whose Delight Is In The Law Of The Lord - Bro. Theo Ovid, Headstone Tabernacle",https://www.youtube.com/watch?v=FacZyAQZNv8,2025-12-23,English,Full Sermon
2018-09-02,Success,Olu Omotoyinbo,"Control - Rev. Olu Omotoyinbo, Enugu, Nigeria",https://www.youtube.com/watch?v=l4ZewTK98Cs,2025-12-23,English,Full Sermon
2018-08-26,Success,Theo Ovid,"Behold I Set Before Thee An Open Door - Bro. Theo Ovid, LCA Lagos, Nigeria",https://www.youtube.com/watch?v=nGe0_h5bZqs,2025-12-23,English,Full Sermon
2018-08-19,Success,Stephen Olliviere,Sons Of God In Full Authority  - Bro. Stephen Olliviere,https://www.youtube.com/watch?v=0u09fiwh-4o,2025-12-23,English,Full Sermon
2018-08-12,Success,Unknown Speaker,"In The Evening Time, There Shall Be Light - Bro. Anthony O'Brien, Headstone Tabernacle",https://www.youtube.com/watch?v=MbUFIBFDZco,2025-12-23,English,Full Sermon
2018-08-05,No Transcript,Theo Ovid,"Obedience Is Better Than Sacrifice - Bro. Theo Ovid, Headstone Tabernacle",https://www.youtube.com/watch?v=7RnKJjr_wPI,2025-12-23,Unknown,Full Sermon
2018-07-29,Success,Unknown Speaker,"Full Obedience To The Whole Word Of God Entitles You To The Token - Bro. Ovid, Headstone Taberacle",https://www.youtube.com/watch?v=Pjx25jfXavU,2025-12-23,English,Full Sermon
