date,status,speaker,title,url,last_checked,language,type,description,duration,church
2022-04-19,No Transcript,Rebekah Adams,Watch and See - Rebekah Adams at Louisiana Spring Youth Camp 2022,https://www.youtube.com/watch?v=EzREBuJYL2Q,2026-01-04,Unknown,Youth Service,"Watch and See by the Erwin’s  sung by Rebekah Adams at the Louisiana Easter Weekend Youth Camp in Dry Creek, Louisiana Easter 2022",5,Evening Light Tabernacle
2022-04-19,Success,Christian Life Tabernacle Choir at Louisiana Youth Camp,Egypt,https://www.youtube.com/watch?v=6zzQFeuy30M,2026-01-10,Unknown,Full Sermon,,,Evening Light Tabernacle
2022-04-19,Success,Congregational at Louisiana Spring Camp 2022,Goodness of God,https://www.youtube.com/watch?v=GPKqQ6jFUPQ,2026-01-10,Unknown,Full Sermon,,,Evening Light Tabernacle
2022-04-18,Success,Bro. Ron Spencer at 2022 Louisiana Spring Youth Camp,We Will Accept Nothing Less Than Full Victory,https://www.youtube.com/watch?v=lF4Bm5Qvq6o,2026-01-10,Unknown,Full Sermon,,,Evening Light Tabernacle
2022-04-18,Success,Bro. Donny Reagan at 2022 Louisiana Spring Youth Camp,Standing in the Evil Day,https://www.youtube.com/watch?v=_I8dJlZhnAQ,2026-01-10,Unknown,Full Sermon,,,Evening Light Tabernacle
2022-04-09,Success,"Sis. Laura Burns at Evening Light Tabernacle Minden, LA",My Jesus,https://www.youtube.com/watch?v=iOFs2HLnL54,2026-01-10,Unknown,Full Sermon,,,Evening Light Tabernacle
2022-03-17,No Transcript,Courtney Dexter,"Victorious - Written and Sung by Courtney Dexter at Evening Light Tabernacle Minden, Louisiana",https://www.youtube.com/watch?v=HocDWY5brTI,2026-01-04,Unknown,Church Service,,3,Evening Light Tabernacle
2022-03-16,Success,"Bro. Aaron Oglesby on March 16, 2022 at Evening Light Tab",Broken Walls and the Hunger of Nature,https://www.youtube.com/watch?v=WyEGR9Qkt0I,2026-01-10,Unknown,Full Sermon,,,Evening Light Tabernacle
2022-03-10,No Transcript,Courtney Dexter,Same God - Written and Sung by Courtney Dexter at Evening Light Tabernacle Minden Louisiana,https://www.youtube.com/watch?v=QmXW_0nIKuM,2026-01-04,Unknown,Church Service,,4,Evening Light Tabernacle
2022-02-27,Success,"Evening Light Tabernacle Choir, Minden Louisiana February 27, 2022",You Oughta’ Been There,https://www.youtube.com/watch?v=vYHHtuQgF1U,2026-01-10,Unknown,Full Sermon,,,Evening Light Tabernacle
2022-03-01,Success,"Evening Light Tabernacle Choir Feb 27, 2022",What God Does  Can’t Nobody Do Me Like Jesus,https://www.youtube.com/watch?v=XyW11gMzZYg,2026-01-10,Unknown,Full Sermon,,,Evening Light Tabernacle
2022-03-01,Success,Phillip and Jerry Roncali with Dan Pruitt at Evening Light Tabernacle Minden LA,Nearing That Shore,https://www.youtube.com/watch?v=Hy8OgiB4RBo,2026-01-10,Unknown,Full Sermon,,,Evening Light Tabernacle
2022-03-01,Success,Jerry and Phyllis Roncali at Evening Light Tabernacle Minden Louisiana,I Lean On You Lord,https://www.youtube.com/watch?v=eKsCEYdqeLM,2026-01-10,Unknown,Full Sermon,,,Evening Light Tabernacle
2022-01-15,No Transcript,Unknown Speaker,"Give Us Clean Hands / Spirit Of God Move - Evening Light Tabernacle Congregational Minden, LA",https://www.youtube.com/watch?v=XbuSWBG7mRo,2026-01-04,Unknown,Church Service,,6,Evening Light Tabernacle
Unknown Date,No Transcript,Unknown Speaker,Promises One By One - Evening Light Tabernacle Choir - January 2022 Minden Louisiana,https://www.youtube.com/watch?v=L6UgB3i5R7g,2026-01-04,Unknown,Church Service,,2,Evening Light Tabernacle
2022-01-12,Success,Pastor Tim Pruitt Sermon Excerpt,Jericho,https://www.youtube.com/watch?v=ckGIkOOpTOM,2026-01-10,Unknown,Full Sermon,,,Evening Light Tabernacle
2022-01-10,Success,"Jessica Adams and Laura Burns at Evening Light Tabernacle in Minden, Louisiana",Living Proof,https://www.youtube.com/watch?v=k31IWsjlJcY,2026-01-10,Unknown,Full Sermon,,,Evening Light Tabernacle
2022-01-06,Success,Worship at Evening Light Tabernacle Minden LA,What He’s Done For Me  His Eye Is On The Sparrow,https://www.youtube.com/watch?v=yCiVd9Pgtmc,2026-01-10,Unknown,Full Sermon,,,Evening Light Tabernacle
2021-12-18,Success,Evening Light Tabernacle congregational,Soon and Very Soon  I Know it was the Blood,https://www.youtube.com/watch?v=iD3TKGP9uSc,2026-01-10,Unknown,Full Sermon,,,Evening Light Tabernacle
2021-12-18,No Transcript,Unknown Speaker,"Worthy Of It All - Sam, Emily and Sarah Beth Patton at Evening Light Tabernacle",https://www.youtube.com/watch?v=jK35qjM-eAM,2026-01-04,Unknown,Church Service,"Sung at Evening Light Tabernacle on Wednesday, December 15  Song written by David Brymer and Ryan Hall",5,Evening Light Tabernacle
2021-12-12,Success,"Phillip Roncali at Evening Light Tabernacle in Minden, Louisiana",My Theophany,https://www.youtube.com/watch?v=J3Nl2g51JXQ,2026-01-10,Unknown,Full Sermon,,,Evening Light Tabernacle
2021-11-21,Success,Evening Light Tabernacle Worship,"You Don’t Know Like I Know, What He’s Done For Me",https://www.youtube.com/watch?v=zAf1bL-PPVY,2026-01-10,Unknown,Full Sermon,,,Evening Light Tabernacle
2021-10-11,No Transcript,Benoit Ndaye,Goin’ Up Yonder - Benoit Ndaye at Evening Light Tabernacle Fall 2021 Meetings,https://www.youtube.com/watch?v=Tdj28bk0LPI,2026-01-04,Unknown,Church Service,,5,Evening Light Tabernacle
2021-10-09,Success,Written and Sung by Courtney Dexter with Jessica Conroy and Brandon Winters,His Name Is Jesus,https://www.youtube.com/watch?v=d7pFVe9rTTk,2026-01-10,Unknown,Full Sermon,,,Evening Light Tabernacle
2021-10-09,No Transcript,Unknown Speaker,We Need A Miracle - Jackie Jasik and Choir at Evening Light Tabernacle Fall 2021 Meetings,https://www.youtube.com/watch?v=SDzmW1tfjBA,2026-01-04,Unknown,Church Service,,4,Evening Light Tabernacle
2021-10-09,No Transcript,Jessica Adams,Champion of Love - Jessica Adams at Evening Light Tabernacle Fall 2021 Meetings,https://www.youtube.com/watch?v=dVvnhv44qiQ,2026-01-04,Unknown,Church Service,Sung by Sis. Jessica Adams during the Friday evening service,5,Evening Light Tabernacle
2021-10-09,No Transcript,Unknown Speaker,"Take My Hand, Precious Lord - Faith Cross at Evening Light Tabernacle Fall 2021 Meetings",https://www.youtube.com/watch?v=zK_hj_ZEHk8,2026-01-04,Unknown,Church Service,Sung by Sis. Faith Cross during the Friday evening service,4,Evening Light Tabernacle
2021-10-08,No Transcript,Unknown Speaker,"The Old Rugged Cross - Congregational - Evening Light Tabernacle Fall 2021 Meetings - Minden, LA",https://www.youtube.com/watch?v=kKzVkEWZOxc,2026-01-04,Unknown,Church Service,Sung at the Fall 2021 Meetings,2,Evening Light Tabernacle
2021-10-08,No Transcript,Tim Winters,"Power - Tim Winters at the Evening Light Tabernacle Fall 2021 Meetings in Minden, Louisiana",https://www.youtube.com/watch?v=84Uvuawbbaw,2026-01-04,Unknown,Church Service,Sung at the Fall 2021 Special Meetings,4,Evening Light Tabernacle
2021-10-08,No Transcript,Haley Cross,Haley Cross - Through The Fire - Evening Light Tabernacle Fall 2021 Meetings Minden LA,https://www.youtube.com/watch?v=FIKnKKCC1jc,2026-01-04,Unknown,Church Service,"Sung at the Evening Light Tabernacle Fall 2021 Meetings.  So many times I've questioned certain circumstances Or things I could not understand Many times in trials, weakness blurs my vision And my frustration gets so out of hand Its then I am reminded I've never been forsaken I've never had to stand the test alone As I look at all the victories The spirit rises up in me And its through the fire my weakness is made strong  He never promised that the cross would not get heavy And the hill would no",4,Evening Light Tabernacle
2021-10-06,Success,Unknown Speaker,Evening Light Tabernacle 2021 Fall Meetings Begin Tonight! Minden LA,https://www.youtube.com/watch?v=e9zN55JSreE,2026-01-04,Unknown,Church Service,,4,Evening Light Tabernacle
2021-09-05,No Transcript,Breanna McGeary,It Matters To The Master - Sis. Breanna McGeary at Evening Light Tabernacle,https://www.youtube.com/watch?v=03DwCPn0s-I,2026-01-04,Unknown,Church Service,"Sister Breanna McGeary sings at the September 5th 2021 Sunday morning service   lyrics:  When life lets you down, and you feel more broken than whole When the wounds go deeper than words and you can't tell a soul I may not know what you're going through May not can make that high mountain move But one thing I've found that I really want you to know  If it matters to you, it matters to the master He wants to share the burdens you bear Whisper peace when your world gets shattered If it's your grea",3,Evening Light Tabernacle
2021-09-02,Success,Pastor Tim Pruitt At Evening Light Tabernacle,Healing In The Communion,https://www.youtube.com/watch?v=kgYG-BL08-4,2026-01-10,Unknown,Full Sermon,,,Evening Light Tabernacle
Unknown Date,No Transcript,Andrew Tushner,I Thank God - Andrew Tushner at Evening Light Tabernacle,https://www.youtube.com/watch?v=_ehYqop6cNU,2026-01-04,Unknown,Church Service,,5,Evening Light Tabernacle
2021-08-25,No Transcript,Unknown Speaker,I Know The Master Of The Wind - Congregational - Evening Light Tabernacle,https://www.youtube.com/watch?v=FTAmd5aESR4,2026-01-04,Unknown,Church Service,Lyrics  My boat of life Sails on a troubled sea Èver there's a wind in my sail But i have a friend Who watches over me When the breeze turns into a gale  I know the master of the wind I know the maker of the rain He  can calm the storm And make the sun to shine again I know the master of the wind  Sometimes i soar like an eagle in the heights Among the peaks my soul can be found An unexpected storm May drive me from the heights It may bring me low But it will never bring me down  Song by Steve L,3,Evening Light Tabernacle
Unknown Date,No Transcript,Tim Pruitt,"Resurrection Hour - 8.22.21 Excerpts Pastor Tim Pruitt at Evening Light Tabernacle Minden, Louisiana",https://www.youtube.com/watch?v=sOumg3NRqMk,2026-01-04,Unknown,Easter Program,,6,Evening Light Tabernacle
2021-08-24,No Transcript,North Carolina,Blameless - North Carolina Choir at Evening Light Tabernacle,https://www.youtube.com/watch?v=TlkxjoDFxqw,2026-01-04,Unknown,Church Service,"Lyrics  hat manner of love is this That You would lay down Your life You paid the price, the sacrifice for redemption Now I am determined to know Christ and Him crucified Now alive and the power in me is You  Now blameless, You call me Holy I've been forgiven, You call me righteous and free Now spotless, You call me worthy I am Your child, You call me chosen I'm Yours, I am Yours  I will boldly come Running straight to the One Singing over me Your songs of salvation No one can take this from me ",5,Evening Light Tabernacle
2021-08-23,Success,Written and Sung by Courtney Dexter at Evening Light Tabernacle,Hope for the Hopeless,https://www.youtube.com/watch?v=CwR35YMAm-A,2026-01-10,Unknown,Full Sermon,,,Evening Light Tabernacle
2021-08-20,No Transcript,Unknown Speaker,I’ll Fly Away and Come and Go With Me - Congregational - Evening Light Tabernacle,https://www.youtube.com/watch?v=j9Mwbgbi4EY,2026-01-04,Unknown,Church Service,,4,Evening Light Tabernacle
2021-08-19,Success,Rebekah Adams at Evening Light Tabernacle,Thank You Jesus for the Blood,https://www.youtube.com/watch?v=wSO-Ihitoec,2026-01-10,Unknown,Full Sermon,,,Evening Light Tabernacle
2021-08-18,Success,Written and Sung by Andrew Tushner at Evening Light Tabernacle,Abundance of Rain,https://www.youtube.com/watch?v=eqclbUvYJ_4,2026-01-10,Unknown,Full Sermon,,,Evening Light Tabernacle
2021-08-17,No Transcript,Lily Harwell,The Middle of My Storm - Lily Harwell at Evening Light Tabernacle,https://www.youtube.com/watch?v=iTvWyl4KPYI,2026-01-04,Unknown,Church Service,"Lyrics  I've been there, in the lowest of times I've had questions in my mind, I've been scared But I know that I have a Savior Who knows right where I am and hears my prayer In the midst of all the problems and burdens of this life I will call upon the One Who can get me through the night  Lord hold my hand, in the middle of my storm When I'm sinking down, help me to stand When the waves are crushing 'round May I keep my eyes on You 'Cause Lord You're the only one Who can help me get through Th",4,Evening Light Tabernacle
2021-08-12,Success,Jeremy and Sadie Butts with Phillip Roncali at Evening Light Tabernacle,Never Lost,https://www.youtube.com/watch?v=aNu59KvnDog,2026-01-10,Unknown,Full Sermon,,,Evening Light Tabernacle
2021-08-12,Success,Sis. Joann Rae,This Is Just What Heaven Means To Me,https://www.youtube.com/watch?v=gtRwUPeCx0Q,2026-01-10,Unknown,Full Sermon,,,Evening Light Tabernacle
2021-08-11,Success,Bro. Wendall Martin at Memorial for Sis. Karen Pruitt,I’m Not Giving Up,https://www.youtube.com/watch?v=_Au8F1g_dg0,2026-01-10,Unknown,Full Sermon,,,Evening Light Tabernacle
Unknown Date,No Transcript,Unknown Speaker,Glory Glory - Evening Light Tabernacle Youth Choir Service Opening Praise,https://www.youtube.com/watch?v=deMP-e0II-o,2026-01-04,Unknown,Church Service,,6,Evening Light Tabernacle
2021-08-10,No Transcript,Rebekah Adams,Ain’t No Bird - Rebekah Adams at Evening Light Tabernacle,https://www.youtube.com/watch?v=sfXCji-dHgI,2026-01-04,Unknown,Church Service,"Ain’t No Bird - Sung by Rebekah Adams during service at Evening Light Tabernacle in Minden, Louisiana",4,Evening Light Tabernacle
2021-08-10,No Transcript,Courtney Dexter,While We Praise - Written and Sung by Courtney Dexter at Evening Light Tabernacle,https://www.youtube.com/watch?v=bj3on9SNSZY,2026-01-04,Unknown,Church Service,This song was written and sung by Courtney Dexter at Evening Light Tabernacle,5,Evening Light Tabernacle
2021-08-09,No Transcript,Brandon Winters,Speak to the Mountains - Brandon Winters and Adrianna Pruitt at Evening Light Tabernacle - Minden LA,https://www.youtube.com/watch?v=MJUDCVhTArc,2026-01-04,Unknown,Church Service,"Speak to the Mountains Sung by Brandon Winters and Adrianna Pruitt at Evening Light Tabernacle in Minden, Louisiana  Song by Chris McClarney  Lyrics:  Why would I worry When giants come calling my name? My God is so much bigger than troubles I face Why would I hunger For power or riches or fame? Oh, 'cause my God is so much better than all of these things So I won't be shaken I won't be moved My God is faithful His promise is true So I speak to the mountains Oh, it's time to move Cause my God is",4,Evening Light Tabernacle
2021-08-09,No Transcript,Courtney Dexter,Out of the Darkness - Written and Sung By Courtney Dexter at Evening Light Tabernacle,https://www.youtube.com/watch?v=eYWhRKRMy44,2026-01-04,Unknown,Church Service,"Written and Sung By Courtney Dexter at Evening Light Tabernacle In Minden, Louisiana  Lyrics   I’ve seen mountains move  At Your command  I’ve seen the stones rolls back With the power of Your hand  I’ve seen oceans part  Revealing dry land  I’ve seen the waves bow down  To Your mighty Name    Out of the darkness  You spoke the light  And out of nothing  You created life  Out from the ashes New hope arises  And with the sunrise  Mercy renews  And I’ve never seen  One thing that You can’t do   Ch",5,Evening Light Tabernacle
2021-08-09,No Transcript,Jeremy Shriner,Praise You In This Storm - Bro Jeremy Shriner and Congregation - Worship,https://www.youtube.com/watch?v=A5NEes53zgw,2026-01-04,Unknown,Church Service,"Praise You In This Storm (Casting Crowns)  Bro Jeremy Shriner and Congregation at Evening Light Tabernacle Memorial Service for Sis Mary Karen Pruitt on August 8th, 2021  Lyrics  I was sure by now God, You would have reached down And wiped our tears away Stepped in and saved the day And once again I say, ""A-men"" and it's still rainin' But as the thunder rolls I barely hear Your whisper through the rain ""I'm with you"" And as Your mercy falls I'll raise my hands and praise the God who gives And ta",4,Evening Light Tabernacle
2021-08-09,No Transcript,Ron Spencer,On The Wings Of A Dove - Worship - Bro. Ron Spencer and Congregation - At Sis. Karen Pruitt Memorial,https://www.youtube.com/watch?v=RcrukjbIKNw,2026-01-04,Unknown,Memorial Service,"On The Wings Of A Dove Sung at the Memorial Service for Sister Mary Karen Pruitt on August 8th, 2021  Noah had drifted  On the floods many days,  He searched for land  In various ways;  Troubles he had some,  But not from above,  God gave him His sign  On the wings of a dove.  CHORUS On the wings of a snow-white dove, God sends down His pure, sweet love, A sign from above, On the wings of a dove.  Jesus, our Saviour  Came to earth one day;  He was born in a stable,  In a manger of hay;  Though h",3,Evening Light Tabernacle
2021-07-04,Success,"Bro. Tim Pruitt on July 4, 2021","The People of the Book, Part 127 (Fighting, Yet Seated)",https://www.youtube.com/watch?v=IiCetD-HsrQ,2026-01-10,Unknown,Full Sermon,,,Evening Light Tabernacle
2021-06-06,Success,Bro. Tim Pruitt,"The People of the Book, Part 123 (The Battle for Preeminence)",https://www.youtube.com/watch?v=CwpjTlrve_0,2026-01-10,Unknown,Full Sermon,,,Evening Light Tabernacle
2021-05-12,Success,Bro. Timothy Pruitt,Jesus the Same,https://www.youtube.com/watch?v=bX_UI3vrMh4,2026-01-10,Unknown,Full Sermon,,,Evening Light Tabernacle
2021-04-03,Success,Hno. Andrew Spencer,Español,https://www.youtube.com/watch?v=97g-dmM45Hc,2026-01-10,Unknown,Full Sermon,,,Evening Light Tabernacle
2021-04-03,Success,Bro. Andrew Spencer,Ain't No Grave,https://www.youtube.com/watch?v=8mekladcpww,2026-01-10,Unknown,Full Sermon,,,Evening Light Tabernacle
2021-04-02,Success,Peligroso,Español- Hno. Danny Stemen,https://www.youtube.com/watch?v=WO-s33ixj4Y,2026-01-10,Unknown,Full Sermon,,,Evening Light Tabernacle
2021-03-07,No Transcript,Unknown Speaker,"10,000 Reasons - Evening Light Tabernacle Youth Choir",https://www.youtube.com/watch?v=QvQ0fujkDgU,2026-01-04,Unknown,Church Service,"The youth choir at Evening Light Tabernacle sings ""10,000 Reasons"" live during church. For more information about the church and to view sermons online, please visit www.eveninglight.net. God bless you!",4,Evening Light Tabernacle
2021-03-07,No Transcript,Unknown Speaker,Believe For It - Evening Light Tabernacle Adult Choir,https://www.youtube.com/watch?v=YmahVOaz6eg,2026-01-04,Unknown,Church Service,"The adult choir at Evening Light Tabernacle (Minden, LA) sings ""Believe For It"" live in church. For more information about the church and to view sermons online, please visit www.eveninglight.net. God bless you!",8,Evening Light Tabernacle
2021-02-24,Success,Bro. Timothy Pruitt at Evening Light Tabernacle,Step Into The Water,https://www.youtube.com/watch?v=fi3D8yJFLNs,2026-01-10,Unknown,Full Sermon,,,Evening Light Tabernacle
2021-02-10,No Transcript,Timothy Pruitt,"Casting Down Imagination, Part 13 (The Stronghold of Unbelief, Part 2) - Bro. Timothy Pruitt",https://www.youtube.com/watch?v=v8fXE-dKlbs,2026-01-04,Unknown,Church Service,"Bro. Timothy Pruitt ministers on ""Casting Down Imagination, Part 13 (The Stronghold of Unbelief, Part 2)"" during the Wednesday evening service at Evening Light Tabernacle (Minden, LA) on February 10, 2021. For more information about the church and to view more services online, please visit www.eveninglight.net. God bless you!",131,Evening Light Tabernacle
2021-01-13,Success,Bro. Timothy Pruitt,"Casting Down Imagination, Part 10 (The Stronghold of Laodicea)",https://www.youtube.com/watch?v=ipxBrjbgRI8,2026-01-10,Unknown,Full Sermon,,,Evening Light Tabernacle
2020-12-20,No Transcript,Bella Fields,"""Noel"" sung by Bella Fields at Evening Light Tabernacle",https://www.youtube.com/watch?v=eJbCB7LCM2U,2026-01-04,Unknown,Church Service,"Bella Fields sings ""Noel"" at Evening Light Tabernacle on December 20, 2020.",3,Evening Light Tabernacle
2020-12-16,Success,Bro. Timothy Pruitt,"Casting Down Imagination, Part 9 (The Power of Endless Life)",https://www.youtube.com/watch?v=3GW8FoExxp8,2026-01-10,Unknown,Full Sermon,,,Evening Light Tabernacle
2020-12-13,No Transcript,Joe Adams,The Road You're On? - Bro. Joe Adams at Evening Light Tabernacle,https://www.youtube.com/watch?v=krl5NotsEB4,2026-01-04,Unknown,Church Service,"Bro. Joe Adams ministers on ""The Road You're On?"" during the Sunday evening youth service at Evening Light Tabernacle (Minden, LA) on December 13, 2020. For more information about the church and to view more services online, please visit www.eveninglight.net. God bless you!",129,Evening Light Tabernacle
2020-12-13,Success,Pastor Tim Pruitt,"The People of the Book, Part 105 (A People of the Double Portion)",https://www.youtube.com/watch?v=NKRenzQ_abQ,2026-01-10,Unknown,Full Sermon,,,Evening Light Tabernacle
2020-12-09,No Transcript,Timothy Pruitt,"Casting Down Imagination, Part 8 (Because it is Written) - Bro. Timothy Pruitt",https://www.youtube.com/watch?v=9xfbc8d5-7Y,2026-01-04,Unknown,Church Service,"Bro. Timothy Pruitt ministers on ""Casting Down Imagination, Part 8 (Because it is Written)"" during the Wednesday evening service at Evening Light Tabernacle (Minden, LA) on December 9, 2020. For more information about the church and to view more services online, please visit www.eveninglight.net. God bless you!",124,Evening Light Tabernacle
2020-12-06,Success,Pastor Tim Pruitt at Evening Light Tabernacle,Healing in the Communion,https://www.youtube.com/watch?v=4xH0eRKfs_c,2026-01-10,Unknown,Full Sermon,,,Evening Light Tabernacle
2020-12-06,No Transcript,Tim Pruitt,"The People of the Book, Part 104 (Be Strong and of a Good Courage) - Pastor Tim Pruitt",https://www.youtube.com/watch?v=7fOaV_XTsrM,2026-01-04,Unknown,Church Service,"Pastor Tim Pruitt ministers on ""The People of the Book, Part 104 (Be Strong and of a Good Courage)"" during the Sunday morning service at Evening Light Tabernacle (Minden, LA) on December 6, 2020. For more information about the church and to view more services online, please visit www.eveninglight.net. God bless you!",162,Evening Light Tabernacle
2020-12-06,Success,Evening Light Tabernacle Youth Choir,Is He Worthy,https://www.youtube.com/watch?v=4hr5uZAVrQ8,2026-01-10,Unknown,Full Sermon,,,Evening Light Tabernacle
2020-12-02,Success,Bro. Timothy Pruitt at Evening Light Tabernacle,"Casting Down Imagination, Part 7",https://www.youtube.com/watch?v=Lwrdk12B9Mg,2026-01-10,Unknown,Full Sermon,,,Evening Light Tabernacle
2020-11-29,Success,Pastor Tim Pruitt at Evening Light,"The People of the Book, Part 103 (Under a Mandate to Speak)",https://www.youtube.com/watch?v=dj3JzMWy2tc,2026-01-10,Unknown,Full Sermon,,,Evening Light Tabernacle
2020-11-22,Success,Bro. Wayne Lawson at Evening Light Tabernacle,Speak What the Spirit Says,https://www.youtube.com/watch?v=p7Ii8IDzfbU,2026-01-10,Unknown,Full Sermon,,,Evening Light Tabernacle
2020-11-18,Success,Favored Through Your Trial,"Thou Hast Found Favor, Part 2",https://www.youtube.com/watch?v=6Nh69jXr_9w,2026-01-10,Unknown,Full Sermon,,,Evening Light Tabernacle
2020-11-15,Success,Pastor Tim Pruitt,"The People of the Book, Part 102  (The Blood and Its Power of Restoration)",https://www.youtube.com/watch?v=aInZ4p_04dk,2026-01-10,Unknown,Full Sermon,,,Evening Light Tabernacle
2020-11-11,Success,Bro. Timothy Pruitt at Evening Light Tabernacle,"Casting Down Imagination, Part 6",https://www.youtube.com/watch?v=csDyTw3fJ2A,2026-01-10,Unknown,Full Sermon,,,Evening Light Tabernacle
2020-11-08,Success,Pastor Tim Pruitt,"The People of the Book, Part 101 (Standing on the Threshold of Full Redemption)",https://www.youtube.com/watch?v=rS-crD0CkGU,2026-01-10,Unknown,Full Sermon,,,Evening Light Tabernacle
2020-11-04,Success,Bro. Timothy Pruitt at Evening Light Tabernacle,"Casting Down Imagination, Part 5",https://www.youtube.com/watch?v=lphyqi3P25o,2026-01-10,Unknown,Full Sermon,,,Evening Light Tabernacle
2020-11-01,Success,Pastor Tim Pruitt,"The People of the Book, Part 100 (Where is the Church Standing)",https://www.youtube.com/watch?v=USXYitxyHHk,2026-01-10,Unknown,Full Sermon,,,Evening Light Tabernacle
2020-10-28,Success,Bro. Timothy Pruitt at Evening Light Tabernacle,"Casting Down Imagination, Part 4",https://www.youtube.com/watch?v=FmktoF2Y1-k,2026-01-10,Unknown,Full Sermon,,,Evening Light Tabernacle
2020-10-25,Success,Bro. Timothy Pruitt at Evening Light Tabernacle,There Shall Be A Time Of Trouble,https://www.youtube.com/watch?v=4JpGxh57IzY,2026-01-10,Unknown,Full Sermon,,,Evening Light Tabernacle
2020-10-21,Success,Bro. Timothy Pruitt at Evening Light Tabernacle,"Casting Down Imagination, Part 3",https://www.youtube.com/watch?v=xUADR2cweBQ,2026-01-10,Unknown,Full Sermon,,,Evening Light Tabernacle
2020-10-18,Success,Pastor Tim Pruitt at Evening Light Tab,"The People of the Book, Part 99 (Anointed Messiah-ettes)",https://www.youtube.com/watch?v=eGs0cCRYL6U,2026-01-10,Unknown,Full Sermon,,,Evening Light Tabernacle
2020-10-14,Success,Bro. Timothy Pruitt at Evening Light Tabernacle,"Casting Down Imagination, Part 2",https://www.youtube.com/watch?v=Huhp-wXvssU,2026-01-10,Unknown,Full Sermon,,,Evening Light Tabernacle
2020-10-11,Success,The Changing of the Seasons,"The People of the Book, Part 98",https://www.youtube.com/watch?v=dZog9Qiy7b8,2026-01-10,Unknown,Full Sermon,,,Evening Light Tabernacle
2020-09-16,No Transcript,Timothy Pruitt,Casting Down Imagination - Bro. Timothy Pruitt at Evening Light Tabernacle,https://www.youtube.com/watch?v=mbUW0YBKPTI,2026-01-04,Unknown,Church Service,"Bro. Timothy Pruitt ministers on ""Casting Down Imaginations"" during the Wednesday evening service at Evening Light Tabernacle (Minden, LA) on September 16, 2020. For more information about the church and to view more services online, please visit www.eveninglight.net. God bless you!",107,Evening Light Tabernacle
2020-09-13,Success,Sis. Jessica Adams and Congregation at Evening Light Tabernacle,I Speak Jesus,https://www.youtube.com/watch?v=hwZ-8mnk2pg,2026-01-10,Unknown,Full Sermon,,,Evening Light Tabernacle
2020-09-13,Success,Is There Hope of Revival Part 8 (The Messiah-ettes),"The People of the Book, Part 97",https://www.youtube.com/watch?v=D3Nn-uY7VFg,2026-01-10,Unknown,Full Sermon,,,Evening Light Tabernacle
