date,status,speaker,title,url,last_checked,language,type,description,duration,church,first_scraped,video_status,video_removed_date
2023-05-22,Success,Adrian Gengan,I’m Here To Shake And Tear Down Satan’s Kingdom  Pastor Adrian Gengan  21-05-2023,https://www.youtube.com/watch?v=XT-ftB3-khw,2026-01-05,Unknown,Church Service,,63.0,Son Of Man Revealed Ministries,2026-01-05,available,
2023-05-18,Success,Adrian Gengan,Deliverance in Mount Zion  Pastor Adrian Gengan  17-05-2023,https://www.youtube.com/watch?v=Nm9k3VVfU-Y,2026-01-05,Unknown,Church Service,,67.0,Son Of Man Revealed Ministries,2026-01-05,available,
2023-12-05,Success,Adrian Gengan,A Consecrated Life filled with Oil & Wine  Pastor Adrian Gengan  12-05-2023,https://www.youtube.com/watch?v=LehE-Fuf9vQ,2026-01-05,Unknown,Short Clip,,50.0,Son Of Man Revealed Ministries,2026-01-05,available,
2023-10-05,Success,Adrian Gengan,The Word + Spirit In The Midst Of A Super Church  Pastor Adrian Gengan  10-05-2023,https://www.youtube.com/watch?v=AzxjiriDtwk,2026-01-05,Unknown,Church Service,,75.0,Son Of Man Revealed Ministries,2026-01-05,available,
2023-03-05,Success,Adrian Gengan,Speak To The Rock Before You Speak To The Mountain  Pastor Adrian Gengan  03-05-2023,https://www.youtube.com/watch?v=7zfKdPj_TAs,2026-01-05,Unknown,Church Service,,75.0,Son Of Man Revealed Ministries,2026-01-05,available,
2023-04-30,Success,Joshua Chetty,"11th Hour Workers, Working In The Third Pull  Bro Joshua Chetty  30-04-2023",https://www.youtube.com/watch?v=kc4Dx-Sz9jk,2026-01-05,Unknown,Church Service,,87.0,Son Of Man Revealed Ministries,2026-01-05,available,
2023-04-25,Success,Ronnie Samson,An Eagles Perspective  Pastor Ronnie Samson  23042023,https://www.youtube.com/watch?v=vPE48SW-wZo,2026-01-05,Unknown,Church Service,,101.0,Son Of Man Revealed Ministries,2026-01-05,available,
2023-04-19,Success,Adrian Gengan,This is the Latter Rain of Branham’s Message  Pastor Adrian Gengan  19-04-2023,https://www.youtube.com/watch?v=u75kQGYT_Iw,2026-01-05,Unknown,Church Service,,96.0,Son Of Man Revealed Ministries,2026-01-05,available,
2023-04-17,Success,Adrian Gengan,2023 Manifesting the Revelation of the Hour  Pastor Adrian Gengan  16-04-2023,https://www.youtube.com/watch?v=VwXIwyy7Ek8,2026-01-05,Unknown,Church Service,,85.0,Son Of Man Revealed Ministries,2026-01-05,available,
2023-02-04,Success,Adrian Gengan,The Dynamic Quickening Power of the Holy Ghost  Pastor Adrian Gengan  02042023,https://www.youtube.com/watch?v=hGhw39zuDtQ,2026-01-05,Unknown,Church Service,,93.0,Son Of Man Revealed Ministries,2026-01-05,available,
2023-03-27,Success,Joshua Chetty,The Acts of the Holy Ghost working in me  Bro Joshua Chetty  19-03-2023,https://www.youtube.com/watch?v=ksDbx_fJ6d4,2026-01-05,Unknown,Church Service,,111.0,Son Of Man Revealed Ministries,2026-01-05,available,
2023-03-27,Success,Paul Ke,The Upper Room Experience  Pastor Paul Ke (India)  22-03-2023,https://www.youtube.com/watch?v=MNp2w1wNRq8,2026-01-05,Unknown,Church Service,,119.0,Son Of Man Revealed Ministries,2026-01-05,available,
2022-09-22,Success,Adrian Gengan,William Branham Prophecy Update  Watching Modern Day Events through Eagle Eyes  Pst Adrian Gengan,https://www.youtube.com/watch?v=e7Q99zIUo4U,2026-01-05,Unknown,Short Clip,,46.0,Son Of Man Revealed Ministries,2026-01-05,available,
2022-07-03,Success,Adrian Gengan,Aborting the Seed of Discrepancy and Reproducing the Seed of God  Pastor Adrian Gengan,https://www.youtube.com/watch?v=0nXhkQoImUk,2026-01-05,Unknown,Short Clip,,45.0,Son Of Man Revealed Ministries,2026-01-05,available,
2022-06-26,Success,Adrian Gengan,Our Groaning for Immortality  Pastor Adrian Gengan,https://www.youtube.com/watch?v=6pMaPF0CY6M,2026-01-05,Unknown,Church Service,,76.0,Son Of Man Revealed Ministries,2026-01-05,available,
2022-06-26,Success,Adrian Gengan,The Placing of A Son  Pastor Adrian Gengan,https://www.youtube.com/watch?v=5zjlIsn6Rzs,2026-01-05,Unknown,Church Service,,70.0,Son Of Man Revealed Ministries,2026-01-05,available,
2022-03-30,Success,Adrian Gengan,Our Assignment is to finish the Mission  Pastor Adrian Gengan,https://www.youtube.com/watch?v=p79HM529bps,2026-01-05,Unknown,Short Clip,,36.0,Son Of Man Revealed Ministries,2026-01-05,available,
2022-03-23,Success,Adrian Gengan,The Final Prophecy in the Age of The Ten Toes  Pastor Adrian Gengan,https://www.youtube.com/watch?v=CE0fOZQizgQ,2026-01-05,Unknown,Short Clip,,31.0,Son Of Man Revealed Ministries,2026-01-05,available,
2022-03-10,Success,Adrian Gengan,Watch Russia King Of The North  Pastor Adrian Gengan,https://www.youtube.com/watch?v=ASweJokqAAk,2026-01-05,Unknown,Short Clip,,33.0,Son Of Man Revealed Ministries,2026-01-05,available,
2021-03-16,Success,Pastor Harold Beckett,There's Nothing New Under The Sun,https://www.youtube.com/watch?v=gp_sjWhQBz4,2026-01-15,Unknown,Full Sermon,,0.0,Son Of Man Revealed Ministries,2026-01-15,available,
2021-03-16,Success,Pastor Harold Beckett,There's Nothing New Under The Sun Pt2,https://www.youtube.com/watch?v=I7hJebzg_ug,2026-01-15,Unknown,Full Sermon,,0.0,Son Of Man Revealed Ministries,2026-01-15,available,
2021-01-30,Success,Margie Mahabeer,Homegoing Celebration Service of Sister Margie Mahabeer,https://www.youtube.com/watch?v=T-ifeO1hXQ0,2026-01-07,Unknown,Memorial Service,,48.0,Son Of Man Revealed Ministries,2026-01-07,available,
2021-01-07,Success,Ronnie Gengan,Homegoing Service of Pastor Ronnie Gengan and Bro. Shawn Gengan,https://www.youtube.com/watch?v=X45BO7dEUwQ,2026-01-05,Unknown,Memorial Service,,54.0,Son Of Man Revealed Ministries,2026-01-05,available,
2020-06-09,Success,Unknown Speaker,She's Taken Up (End Time Message Song),https://www.youtube.com/watch?v=Y7ouKE1-J0Y,2026-01-05,Unknown,Short Clip,,1.0,Son Of Man Revealed Ministries,2026-01-05,available,
2020-05-25,Success,Chintha,Service at Sister Chintha's House,https://www.youtube.com/watch?v=EydFfpUjrOg,2026-01-07,Unknown,Short Clip,,27.0,Son Of Man Revealed Ministries,2026-01-07,available,
2020-05-10,Success,Online Concert,Let The bride Sing,https://www.youtube.com/watch?v=1RsUXclCEHc,2026-01-10,Unknown,Church Service,,,Son Of Man Revealed Ministries,2026-01-10,available,
