date,status,speaker,title,url,last_checked,language,type,description,duration,church,first_scraped,video_status,video_removed_date
2024-04-28,Success,Adrian Gengan,Rejoice That Your Names Are Written In Heaven  Pastor Adrian Gengan  28-04-2024,https://www.youtube.com/watch?v=dpCt25ezkTY,2026-01-05,Unknown,Church Service,,92.0,Son Of Man Revealed Ministries,2026-01-05,available,
2024-04-27,Success,Adrian Gengan,The Best Investment  Pastor Adrian Gengan  24-04-2024 #williammarrionbranham #williambranham,https://www.youtube.com/watch?v=LuHGbI5N8TE,2026-01-27,Unknown,Full Sermon,,0,Son Of Man Revealed Ministries,2026-01-27,available,
2024-04-25,Success,William M. Branham,God Hiding Himself In Simplicity (Animated)  Prophet William Marrion Branham,https://www.youtube.com/watch?v=v8Z-b9A4nKg,2026-01-05,Unknown,Tape Service,,13.0,Son Of Man Revealed Ministries,2026-01-05,available,
2024-04-23,Success,William M. Branham,Adoption Series Part 2 Animated  Prophet William Marrion Branham,https://www.youtube.com/watch?v=StMLlQlSA9U,2026-01-05,Unknown,Tape Service,,8.0,Son Of Man Revealed Ministries,2026-01-05,available,
2024-04-22,Success,Adrian Gengan,Attribute Sons of His Spirit  Pastor Adrian Gengan  Sun AM 21-04-2024,https://www.youtube.com/watch?v=tCyldTG5uEQ,2026-01-27,Unknown,Full Sermon,,0,Son Of Man Revealed Ministries,2026-01-27,available,
2024-04-21,No Transcript,William M. Branham,Adoption Series Part 1 - Animated | Prophet William Marrion Branham,https://www.youtube.com/watch?v=ubjUZwT-fuk,2026-01-05,Unknown,Tape Service,,11.0,Son Of Man Revealed Ministries,2026-01-05,available,
2024-04-18,Success,Adrian Gengan,Our Privileged Position As Sons Of God  Pastor Adrian Gengan  Wed PM 17-04-2024,https://www.youtube.com/watch?v=1vpc9VL6S5o,2026-01-05,Unknown,Church Service,,69.0,Son Of Man Revealed Ministries,2026-01-05,available,
2024-04-14,Success,Joshua Chetty,We are the house the Holy Ghost dwells in  Brother Joshua Chetty 14-04-2024,https://www.youtube.com/watch?v=nIhrGspaotw,2026-01-05,Unknown,Church Service,,82.0,Son Of Man Revealed Ministries,2026-01-05,available,
2024-04-12,Success,Use the Word to Solve Your Problems  Pastor Adrian Gengan  Wed PM 11-04-24,The Spirit Of Wisdom,https://www.youtube.com/watch?v=0dJ-XZ1pKOA,2026-01-15,Unknown,Full Sermon,,0.0,Son Of Man Revealed Ministries,2026-01-15,available,
2023-07-04,Success,Adrian Gengan,Changing Positions  Pastor Adrian Gengan  07-04-2023,https://www.youtube.com/watch?v=QjpNn4kfX7U,2026-01-05,Unknown,Church Service,,84.0,Son Of Man Revealed Ministries,2026-01-05,available,
2024-04-07,Success,Clive Thomas,The Revelation Of Your Pastor  Pastor Clive Thomas  24-03-2024  Sun Am,https://www.youtube.com/watch?v=s7CXNoN1ngQ,2026-01-05,Unknown,Church Service,,104.0,Son Of Man Revealed Ministries,2026-01-05,available,
2024-03-04,Success,Joshua Chetty,I Now Know As I Was Known  Brother Joshua Chetty  03-04-2024,https://www.youtube.com/watch?v=TtOxe5tJR00,2026-01-05,Unknown,Church Service,,79.0,Son Of Man Revealed Ministries,2026-01-05,available,
2024-04-06,Success,Adrian Gengan,The Riches Of His GRACE  Pastor Adrian Gengan  27-03-2024  Wed Pm,https://www.youtube.com/watch?v=hFP3Dy1B_EU,2026-01-05,Unknown,Short Clip,,38.0,Son Of Man Revealed Ministries,2026-01-05,available,
2024-03-31,Success,Moses Dzvova,Understanding Misunderstandings  Easter Convention 2024  Pastor Moses Dzvova  31-03-2024 Sun AM,https://www.youtube.com/watch?v=Wrq4k-hhuZo,2026-01-05,Unknown,Easter Program,,149.0,Son Of Man Revealed Ministries,2026-01-05,available,
2024-03-31,Success,Sunday Evening  Pastor Moses Dzvova  31-03-2024,Easter Convention,https://www.youtube.com/watch?v=4Q3vGbcbJmI,2026-01-15,Unknown,Full Sermon,,0.0,Son Of Man Revealed Ministries,2026-01-15,available,
2024-03-31,Success,Saturday Evening  Pastor Moses Dzvova  30-03-2024,Easter Convention,https://www.youtube.com/watch?v=njtElFQfL2g,2026-01-15,Unknown,Full Sermon,,0.0,Son Of Man Revealed Ministries,2026-01-15,available,
2024-03-31,Success,Moses Dzvova,The Token  Easter Convention 2024 Pastor Moses Dzvova  29-03-2024  Sat PM,https://www.youtube.com/watch?v=51Ani4t_evY,2026-01-05,Unknown,Easter Program,,127.0,Son Of Man Revealed Ministries,2026-01-05,available,
2024-03-31,Success,Fri AM,If Malachi 4 Had Not Come  Easter Convention 2024  Pastor Moses Dzvova  29-03-2024,https://www.youtube.com/watch?v=EZskmVAI-C0,2026-01-15,Unknown,Full Sermon,,0.0,Son Of Man Revealed Ministries,2026-01-15,available,
2024-03-24,Success,Animated  Prophet William Marrion Branham  24-03-2024,The Seven Seals Series  The Seventh Seal,https://www.youtube.com/watch?v=ZXIAP8v9ToE,2026-01-15,Unknown,Full Sermon,,0.0,Son Of Man Revealed Ministries,2026-01-15,available,
2024-03-23,No Transcript,William M. Branham,The Seven Seals Series | The Sixth Seal - Animated | Prophet William Marrion Branham | 23-03-2024,https://www.youtube.com/watch?v=ZaK2SjrNSbI,2026-01-05,Unknown,Tape Service,,10.0,Son Of Man Revealed Ministries,2026-01-05,available,
2024-03-22,Success,Animated  Prophet William Marrion Branham  22-03-2024,The Seven Seals Series  The Fifth Seal,https://www.youtube.com/watch?v=wsfBdLKZO0w,2026-01-15,Unknown,Full Sermon,,0.0,Son Of Man Revealed Ministries,2026-01-15,available,
2024-03-21,Success,Animated  Prophet William Marrion Branham  21-03-2024,The Seven Seals Series  The Fourth Seal,https://www.youtube.com/watch?v=EqqzQcYrv1A,2026-01-15,Unknown,Full Sermon,,0.0,Son Of Man Revealed Ministries,2026-01-15,available,
2024-03-20,Success,Animated  Prophet William Marrion Branham  20-03-2024,The Seven Seals Series  The Third Seal,https://www.youtube.com/watch?v=Rc6ZLuLy8As,2026-01-15,Unknown,Full Sermon,,0.0,Son Of Man Revealed Ministries,2026-01-15,available,
2024-03-19,Success,Animated  Prophet William Marrion Branham  19-03-2024,The Seven Seals Series  The Second Seal,https://www.youtube.com/watch?v=V6-FsOMDWNI,2026-01-15,Unknown,Full Sermon,,0.0,Son Of Man Revealed Ministries,2026-01-15,available,
2024-03-18,Success,Animated  Prophet William Marrion Branham  18-03-2024,The Seven Seals Series  The First Seal,https://www.youtube.com/watch?v=CekG2nQnFpY,2026-01-15,Unknown,Full Sermon,,0.0,Son Of Man Revealed Ministries,2026-01-15,available,
2024-03-18,Success,Adrian Gengan,The Holy Ghost Birthing the Seed of God  Pastor Adrian Gengan  17-03-2024,https://www.youtube.com/watch?v=THBrweEbvAA,2026-01-05,Unknown,Church Service,,99.0,Son Of Man Revealed Ministries,2026-01-05,available,
2024-03-17,Success,Adrian Gengan,Restoring The Kingdom With The Glory of the King  Pastor Adrian Gengan  13-03-2024,https://www.youtube.com/watch?v=YN5IYp1X-aQ,2026-01-05,Unknown,Short Clip,,59.0,Son Of Man Revealed Ministries,2026-01-05,available,
2024-03-11,Success,Man Has The Legal Authority On The Earth  Pastor Adrian Gengan 10-03-24,Let them Have Dominion,https://www.youtube.com/watch?v=Vu9ur-BCBhQ,2026-01-15,Unknown,Full Sermon,,0.0,Son Of Man Revealed Ministries,2026-01-15,available,
2024-06-03,Success,Bringing Back Man's Glory To The Earth  Pastor Adrian Gengan  06-03-2024,The Cloud Of Glory,https://www.youtube.com/watch?v=DrnH3g3K-Nk,2026-01-15,Unknown,Full Sermon,,0.0,Son Of Man Revealed Ministries,2026-01-15,available,
2024-03-03,Success,Unknown Speaker,The Bible Speaks of a True God-Ordained Five-Fold Ministry  Pastor Shane  03-03-2024,https://www.youtube.com/watch?v=G2wgMK9seO4,2026-01-27,Unknown,Full Sermon,,0,Son Of Man Revealed Ministries,2026-01-27,available,
2024-03-02,No Transcript,Benjamin Roberts,Angels on the Ladder | Pastor Benjamin Roberts | 28-02-2024,https://www.youtube.com/watch?v=cue2XHLq1P4,2026-01-05,Unknown,Short Clip,,51.0,Son Of Man Revealed Ministries,2026-01-05,available,
2024-03-01,Success,Mervin Munsamy,Why do we Rejoice (28-02-1963)  Pastor Mervin Munsamy  28-02-2024,https://www.youtube.com/watch?v=4gzCwVgMDaA,2026-01-05,Unknown,Short Clip,,29.0,Son Of Man Revealed Ministries,2026-01-05,available,
2024-03-01,Success,Denzyl Ariyamuthu,What Is This Attraction  Pastor Denzyl Ariyamuthu  28-02-2024,https://www.youtube.com/watch?v=GogzQlh03to,2026-01-05,Unknown,Short Clip,,51.0,Son Of Man Revealed Ministries,2026-01-05,available,
2024-02-25,Success,Joshua Chetty,The Presence of God Unrecognised  Brother Joshua Chetty  25-02-2024,https://www.youtube.com/watch?v=8w6sNhVF8lU,2026-01-05,Unknown,Church Service,,81.0,Son Of Man Revealed Ministries,2026-01-05,available,
2024-02-25,Success,Adrian Gengan,The Harmony That Exist Between Bride & Groom Pastor Adrian Gengan  21-02-2024,https://www.youtube.com/watch?v=mxK5ZGK1ljA,2026-01-05,Unknown,Church Service,,73.0,Son Of Man Revealed Ministries,2026-01-05,available,
2024-02-22,Success,Adrian Gengan,whatisman  Pastor Adrian Gengan  18-02-2024,https://www.youtube.com/watch?v=7xj3Plh46UM,2026-01-27,Unknown,Full Sermon,,0,Son Of Man Revealed Ministries,2026-01-27,available,
2024-11-02,Success,Japheth Chetty,Don’t Cut Off Your Glory  Brother Japheth Chetty  11-02-2024 (E1),https://www.youtube.com/watch?v=CWBZZgDyLSw,2026-01-05,Unknown,Short Clip,,41.0,Son Of Man Revealed Ministries,2026-01-05,available,
2024-02-14,Success,Adrian Gengan,"Mount Zion, The Hill of His Glory  Pastor Adrian Gengan  14-02-2024",https://www.youtube.com/watch?v=njtswvJMl5U,2026-01-05,Unknown,Short Clip,,47.0,Son Of Man Revealed Ministries,2026-01-05,available,
2024-11-02,Success,Joshua Chetty,The Manifestation Of His Glory  Brother Joshua Chetty  11-02-2024 (E2),https://www.youtube.com/watch?v=oRF70QFVREs,2026-01-05,Unknown,Short Clip,,42.0,Son Of Man Revealed Ministries,2026-01-05,available,
2024-12-02,Success,The Woman is the Glory of The Man  Pastor Adrian Gengan  12-02-2024,whatisawoman,https://www.youtube.com/watch?v=J9AT5leb74E,2026-01-27,Unknown,Full Sermon,,0,Son Of Man Revealed Ministries,2026-01-27,available,
2024-04-02,Success,Denzyl Ariyamuthu,Recognising The Drum Beat of Change  Pastor Denzyl Ariyamuthu  04-02-2024,https://www.youtube.com/watch?v=phw6QqShwQE,2026-01-05,Unknown,Church Service,,102.0,Son Of Man Revealed Ministries,2026-01-05,available,
2024-02-10,Success,Adrian Gengan,You May Have Missed The Angel But Now Comes His Glory  Pastor Adrian Gengan  31-01-2024,https://www.youtube.com/watch?v=fhO2v9zIcPU,2026-01-05,Unknown,Church Service,,77.0,Son Of Man Revealed Ministries,2026-01-05,available,
2024-07-02,Success,Adrian Gengan,"The Secret Food, Deity Embodied in us  Pastor Adrian Gengan  07-02-2024",https://www.youtube.com/watch?v=pkbn7n81V-g,2026-01-05,Unknown,Church Service,,88.0,Son Of Man Revealed Ministries,2026-01-05,available,
2024-01-28,Success,Joshua Chetty,Living In The Realm of His Glory  Brother Joshua Chetty  28-01-2024,https://www.youtube.com/watch?v=kwbb36PaC_4,2026-01-05,Unknown,Church Service,,91.0,Son Of Man Revealed Ministries,2026-01-05,available,
2024-01-25,Success,Japheth Chetty,Who's Glory Will You Share In  Bro Japheth Chetty  24012024,https://www.youtube.com/watch?v=sD4OaE-H-eA,2026-01-05,Unknown,Church Service,,76.0,Son Of Man Revealed Ministries,2026-01-05,available,
2024-01-21,Success,Adrian Gengan,A Glorious Church  Pastor Adrian Gengan  21-01-2024,https://www.youtube.com/watch?v=rhGwc9ROEPk,2026-01-05,Unknown,Church Service,,71.0,Son Of Man Revealed Ministries,2026-01-05,available,
2024-01-14,Success,Adrian Gengan,"Glorify Me With The Glory, That Jesus Has Given Me  Pastor Adrian Gengan  14-01-2024",https://www.youtube.com/watch?v=cw1YaszbsXE,2026-01-05,Unknown,Church Service,,77.0,Son Of Man Revealed Ministries,2026-01-05,available,
2024-07-01,Success,Adrian Gengan,The Glory of This Latter House Shall be Greater than the Former  Pastor Adrian Gengan  07012024,https://www.youtube.com/watch?v=t8CM0wikepc,2026-01-05,Unknown,Church Service,,86.0,Son Of Man Revealed Ministries,2026-01-05,available,
2024-01-01,Success,Adrian Gengan,Share in His Glory 2024 (New year eve Watch-night meeting)  Pastor Adrian Gengan  31122023,https://www.youtube.com/watch?v=7_05aWwx7yc,2026-01-05,Unknown,New Year Service,,161.0,Son Of Man Revealed Ministries,2026-01-05,available,
2023-12-31,Success,Adrian Gengan,Led By the Angel To Receive A Double Portion For Continuation  Pastor Adrian Gengan  311223,https://www.youtube.com/watch?v=WnJeme3ECt0,2026-01-05,Unknown,Church Service,,88.0,Son Of Man Revealed Ministries,2026-01-05,available,
2023-12-26,Success,Adrian Gengan,Another Mary  Pastor Adrian Gengan  24-12-2023,https://www.youtube.com/watch?v=bGonVipD7hE,2026-01-05,Unknown,Church Service,,78.0,Son Of Man Revealed Ministries,2026-01-05,available,
2023-12-21,Success,Unknown Speaker,Let Presence of Jesus Christ (The Word) Have The Preeminence  Pastor Moses (Ghana)  13-12-2023,https://www.youtube.com/watch?v=pyznZmIESao,2026-01-27,Unknown,Full Sermon,,0,Son Of Man Revealed Ministries,2026-01-27,available,
2023-06-12,Success,Unknown Speaker,"Church, Do you recognize what you have done  Bro Joshua (Joey) Chetty  06122023",https://www.youtube.com/watch?v=idL3v7afZZo,2026-01-27,Unknown,Full Sermon,,0,Son Of Man Revealed Ministries,2026-01-27,available,
2023-12-13,Success,Joshua Chetty,The sick sinful world is looking for the Real Church of the Living God  Bro Joshua Chetty 10-12-23,https://www.youtube.com/watch?v=dZf-ecPc1L4,2026-01-05,Unknown,Church Service,,107.0,Son Of Man Revealed Ministries,2026-01-05,available,
2023-03-12,Success,Adrian Gengan,Continue in the Word to see the Promise Fulfilled  Pastor Adrian Gengan  03-12-2023,https://www.youtube.com/watch?v=0aklVYgBbeo,2026-01-05,Unknown,Church Service,,78.0,Son Of Man Revealed Ministries,2026-01-05,available,
2023-12-02,Success,Adrian Gengan,"Elisha, Now is the Time to Unleash Your Double Portion Anointing  Pastor Adrian Gengan  29-11-2023",https://www.youtube.com/watch?v=XsRAYATeN0M,2026-01-05,Unknown,Church Service,,81.0,Son Of Man Revealed Ministries,2026-01-05,available,
2023-11-26,Success,Adrian Gengan,Character with Power is Fit to Rule  Pastor Adrian Gengan  26-11-2023,https://www.youtube.com/watch?v=Q1Aulh60Ucc,2026-01-05,Unknown,Church Service,,81.0,Son Of Man Revealed Ministries,2026-01-05,available,
2023-11-22,Success,Adrian Gengan,Seasons  Pastor Adrian Gengan  22112023,https://www.youtube.com/watch?v=IBWDQylAFXc,2026-01-05,Unknown,Church Service,,74.0,Son Of Man Revealed Ministries,2026-01-05,available,
2023-11-20,Success,Joshua Chetty,Manifestation of the Greater works before changing dimensions  Bro Joshua Chetty  19112023,https://www.youtube.com/watch?v=QSbK3kpP1QY,2026-01-05,Unknown,Church Service,,78.0,Son Of Man Revealed Ministries,2026-01-05,available,
2023-11-16,Success,Part 2  Pastor Adrian Gengan  15112023,Manifesting the Light of Mark 1123 To Make it Live,https://www.youtube.com/watch?v=Uaf7fS1QloE,2026-01-15,Unknown,Full Sermon,,0.0,Son Of Man Revealed Ministries,2026-01-15,available,
2023-12-11,Success,Part 1  Pastor Adrian Gengan  12112023,Manifesting the Light of Mark 1123 To Make it Live,https://www.youtube.com/watch?v=gmUvXM5WQH0,2026-01-15,Unknown,Full Sermon,,0.0,Son Of Man Revealed Ministries,2026-01-15,available,
2023-08-11,Success,Adrian Gengan,Breaking Strongholds  Gaza (Strong City) Hamas (Violence)  Pastor Adrian Gengan  08112023,https://www.youtube.com/watch?v=p2S3-u_NdHM,2026-01-05,Unknown,Church Service,,81.0,Son Of Man Revealed Ministries,2026-01-05,available,
2023-05-11,Success,Adrian Gengan,The Authority of Mark 1123 In Me  Pastor Adrian Gengan  05112023,https://www.youtube.com/watch?v=JGtlN-wu0yc,2026-01-05,Unknown,Church Service,,97.0,Son Of Man Revealed Ministries,2026-01-05,available,
2023-01-11,Success,Joshua Chetty,God’s Provided Way  Bro Joshua Chetty  01112023,https://www.youtube.com/watch?v=MgXyu1WhBeY,2026-01-05,Unknown,Church Service,,92.0,Son Of Man Revealed Ministries,2026-01-05,available,
2023-10-29,Success,Adrian Gengan,The Law of Faith  Pastor Adrian Gengan  29-10-2023,https://www.youtube.com/watch?v=se50RmdAgfM,2026-01-05,Unknown,Church Service,,72.0,Son Of Man Revealed Ministries,2026-01-05,available,
2023-10-23,Success,Japheth Chetty,Overcoming the kings of the flesh & rescuing Lot before communion  Bro Japheth Chetty  18-10-2023,https://www.youtube.com/watch?v=WQZhMCEO7h0,2026-01-05,Unknown,Communion Service,,77.0,Son Of Man Revealed Ministries,2026-01-05,available,
2023-10-22,Success,Joshua Chetty,Possessing Territory  Bro Joshua Chetty  22-10-2023,https://www.youtube.com/watch?v=D3rN_mMbvLw,2026-01-05,Unknown,Church Service,,88.0,Son Of Man Revealed Ministries,2026-01-05,available,
2023-10-15,Success,Adrian Gengan,Finding Isaac a Wife  Pastor Adrian Gengan  15-10-2023,https://www.youtube.com/watch?v=erbW0HR37og,2026-01-05,Unknown,Church Service,,95.0,Son Of Man Revealed Ministries,2026-01-05,available,
2023-07-10,Success,Adrian Gengan,Worship that Pleases God  Pastor Adrian Gengan  07-10-2023,https://www.youtube.com/watch?v=DxOliVhxfGw,2026-01-05,Unknown,Church Service,,122.0,Son Of Man Revealed Ministries,2026-01-05,available,
2022-04-10,Success,Tafara Madzinga,The Word Test  Pastor Tafara Madzinga (Zimbabwe)  04-10-2022,https://www.youtube.com/watch?v=HnJyh1wNv5c,2026-01-05,Unknown,Church Service,,115.0,Son Of Man Revealed Ministries,2026-01-05,available,
2023-01-10,Success,Adrian Gengan,Perfect Faith For The Body Change  Pastor Adrian Gengan  01-10-2023,https://www.youtube.com/watch?v=rqJXIc9rrPg,2026-01-05,Unknown,Church Service,,102.0,Son Of Man Revealed Ministries,2026-01-05,available,
2023-09-28,Success,Adrian Gengan,We Have a Double Portion Anointing of The Holy Spirit  Pastor Adrian Gengan  27-09-2023,https://www.youtube.com/watch?v=h9g_NIvblQc,2026-01-05,Unknown,Church Service,,86.0,Son Of Man Revealed Ministries,2026-01-05,available,
2023-09-25,Success,Adrian Gengan,Son's of God + Angels vs Demons  Spiritual Warfare  Pastor Adrian Gengan  24092023,https://www.youtube.com/watch?v=PPgyuoEbauI,2026-01-05,Unknown,Church Service,,71.0,Son Of Man Revealed Ministries,2026-01-05,available,
2023-09-19,Success,Spirits,Ministering Spirits Our Association with the Unseen World and The The Supernatural  17-09-23,https://www.youtube.com/watch?v=Q-fbS3t_bG4,2026-01-27,Unknown,Full Sermon,,0,Son Of Man Revealed Ministries,2026-01-27,available,
2023-09-14,Success,Japheth Chetty,Spiritual Astronauts [Serving God's Purpose]  Bro Japheth Chetty  13-09-2023,https://www.youtube.com/watch?v=pnf2XHp_qX8,2026-01-05,Unknown,Church Service,,83.0,Son Of Man Revealed Ministries,2026-01-05,available,
2023-11-09,Success,Joshua Chetty,The Image of God Being Manifested On The Earth  Bro Joshua Chetty  11092023,https://www.youtube.com/watch?v=JKFoBJg5esg,2026-01-05,Unknown,Church Service,,136.0,Son Of Man Revealed Ministries,2026-01-05,available,
2023-06-09,Success,Adrian Gengan,Simeon Waiting On Mary To Bring Forth The Lord's Christ  06092023  Pastor Adrian Gengan,https://www.youtube.com/watch?v=CEjbPn_YVZU,2026-01-05,Unknown,Church Service,,66.0,Son Of Man Revealed Ministries,2026-01-05,available,
2023-03-09,Success,Adrian Gengan,The Angel Of The Lord Performs The Supernatural In Another Mary  03092023  Pastor Adrian Gengan,https://www.youtube.com/watch?v=f5_O7qRzxOo,2026-01-05,Unknown,Church Service,,84.0,Son Of Man Revealed Ministries,2026-01-05,available,
2023-08-31,Success,Adrian Gengan,Does your Expectation meet God’s Expectation in 2023   Pastor Adrian Gengan  30082023,https://www.youtube.com/watch?v=grF2lUdr9OI,2026-01-05,Unknown,Short Clip,,50.0,Son Of Man Revealed Ministries,2026-01-05,available,
2023-08-29,Success,Denzyl Ariyamuthu,Jehovah Jireh  27082023 Pastor Denzyl Ariyamuthu,https://www.youtube.com/watch?v=YyKVUty6ng4,2026-01-05,Unknown,Church Service,,99.0,Son Of Man Revealed Ministries,2026-01-05,available,
2023-08-24,Success,Adrian Gengan,Do You Have the Life of Christ  230823  Pastor Adrian Gengan,https://www.youtube.com/watch?v=DGJiOIMdRyQ,2026-01-05,Unknown,Church Service,,86.0,Son Of Man Revealed Ministries,2026-01-05,available,
2023-08-22,Success,Adrian Gengan,I Have Creative Power In Me NOW  20-08-2023  Pastor Adrian Gengan,https://www.youtube.com/watch?v=m7LVsBecJrg,2026-01-05,Unknown,Church Service,,136.0,Son Of Man Revealed Ministries,2026-01-05,available,
2023-08-19,Success,Adrian Gengan,The Final Voice to the Final Age  16-08-2023  Pastor Adrian Gengan,https://www.youtube.com/watch?v=E6N2tkECxH4,2026-01-05,Unknown,Church Service,,89.0,Son Of Man Revealed Ministries,2026-01-05,available,
2023-08-19,Success,Adrian Gengan,Nothing Can Stop God's Plan for Your Life  13082023  Pastor Adrian Gengan,https://www.youtube.com/watch?v=z5leSwrtjNA,2026-01-05,Unknown,Church Service,,96.0,Son Of Man Revealed Ministries,2026-01-05,available,
2023-09-08,Success,Adrian Gengan,How Are We Preparing For The Promise  Pastor Adrian Gengan  09-08-2023,https://www.youtube.com/watch?v=qK04_sm_8EY,2026-01-05,Unknown,Church Service,,88.0,Son Of Man Revealed Ministries,2026-01-05,available,
2023-06-08,No Transcript,Adrian Gengan,Journey of Abraham’s Faith | Pastor Adrian Gengan | 06-08-2023,https://www.youtube.com/watch?v=Nu89FaCcB_g,2026-01-05,Unknown,Church Service,,88.0,Son Of Man Revealed Ministries,2026-01-05,available,
2023-02-08,Success,Joshua Chetty,Living in my Father’s Economy  Brother Joshua Chetty  02-08-2023,https://www.youtube.com/watch?v=7x89VJqGdZM,2026-01-05,Unknown,Church Service,,63.0,Son Of Man Revealed Ministries,2026-01-05,available,
2023-07-31,Success,The Final Voice  Pastor Adrian Gengan  30-07-2023,Our Faith,https://www.youtube.com/watch?v=RrDXK9vRV3Q,2026-01-15,Unknown,Full Sermon,,0.0,Son Of Man Revealed Ministries,2026-01-15,available,
2023-07-26,Success,Prega Pillay,Turning Back the Clock Redeeming the Time  Bro Prega Pillay  23-07-2022,https://www.youtube.com/watch?v=b0fGt7tETRs,2026-01-05,Unknown,Church Service,,104.0,Son Of Man Revealed Ministries,2026-01-05,available,
2023-07-26,Success,Adrian Gengan,My Faith in the WORD is producing the Greater Works  Pastor Adrian Gengan  26-07-2023,https://www.youtube.com/watch?v=yWLrXHf_zGM,2026-01-05,Unknown,Church Service,,83.0,Son Of Man Revealed Ministries,2026-01-05,available,
2023-07-19,Success,Adrian Gengan,Expressions of Faith  Pastor Adrian Gengan  19-07-2023,https://www.youtube.com/watch?v=u2U1UbkJWVw,2026-01-05,Unknown,Church Service,,101.0,Son Of Man Revealed Ministries,2026-01-05,available,
2023-07-18,Success,Bring the Unseen to the Seen World  Pastor Adrian Gengan  16072023,Faith is the Raw Material,https://www.youtube.com/watch?v=TDfJuxei-n4,2026-01-15,Unknown,Full Sermon,,0.0,Son Of Man Revealed Ministries,2026-01-15,available,
2023-09-07,Success,Sunny Ganess,God Fulfilling His Promises  Bro Sunny Ganess  09-07-2023,https://www.youtube.com/watch?v=7v5ha3H2pG0,2026-01-27,Unknown,Full Sermon,,0,Son Of Man Revealed Ministries,2026-01-27,available,
2023-12-07,Success,Tafara Madzinga,Why Cry  Speak  Pastor Tafara Madzinga (Zimbabwe)  12-07-2023,https://www.youtube.com/watch?v=bn5usJ1ohxE,2026-01-05,Unknown,Church Service,,83.0,Son Of Man Revealed Ministries,2026-01-05,available,
2023-05-07,Success,Adrian Gengan,We have an Inheritance {The Word of God}  Pastor Adrian Gengan  05072023,https://www.youtube.com/watch?v=nt_ndhSsMsg,2026-01-05,Unknown,Church Service,,87.0,Son Of Man Revealed Ministries,2026-01-05,available,
2023-02-07,Success,Joshua Chetty,Sons of God Expressed to Light up this age  Bro Joshua Chetty  02-07-2023,https://www.youtube.com/watch?v=Gwh97REFD8M,2026-01-05,Unknown,Church Service,,105.0,Son Of Man Revealed Ministries,2026-01-05,available,
2023-06-28,Success,Dan Matanga,There is a spirit hanging over You  Pastor Dan Matanga (Zimbabwe)  29-06-2023,https://www.youtube.com/watch?v=6RSbhRR5Qg8,2026-01-05,Unknown,Church Service,,111.0,Son Of Man Revealed Ministries,2026-01-05,available,
2023-06-21,Success,Countering Negativity with Positivity  Pastor Adrian Gengan  21-06-2023,When Sons speak,https://www.youtube.com/watch?v=Obn19BbwRrk,2026-01-15,Unknown,Full Sermon,,0.0,Son Of Man Revealed Ministries,2026-01-15,available,
2023-06-18,Success,Adrian Gengan,Father's Day 2023  Our Father is God  Pastor Adrian Gengan  18-06-2023,https://www.youtube.com/watch?v=Znan5U-EFWg,2026-01-05,Unknown,Church Service,,83.0,Son Of Man Revealed Ministries,2026-01-05,available,
2023-06-15,Success,Japheth Chetty,The Manifestation Of The Godman In Each Exodus  The Rei Vindicatio Action  Brother Japheth Chetty,https://www.youtube.com/watch?v=61pa4zSuNBE,2026-01-05,Unknown,Church Service,,72.0,Son Of Man Revealed Ministries,2026-01-05,available,
2023-11-06,Success,Adrian Gengan,Ye are gods  Pastor Adrian Gengan  11-06-2023,https://www.youtube.com/watch?v=POzW4BVaAOk,2026-01-05,Unknown,Church Service,,98.0,Son Of Man Revealed Ministries,2026-01-05,available,
2023-07-06,Success,Adrian Gengan,The Effects and Benefits of the Revelation of the Word of God  Pastor Adrian Gengan  07-06-2023,https://www.youtube.com/watch?v=pgc1CYmbEn4,2026-01-05,Unknown,Short Clip,,51.0,Son Of Man Revealed Ministries,2026-01-05,available,
2023-04-06,Success,Let it be written  Pastor Adrian Gengan  04-06-2023,Queen of queens Pt 6,https://www.youtube.com/watch?v=9Pr5OH6CWtg,2026-01-15,Unknown,Full Sermon,,0.0,Son Of Man Revealed Ministries,2026-01-15,available,
2023-01-06,Success,Joshua Chetty,A People that’s Anointed and Fruitful  Bro Joshua Chetty  01-06-2023,https://www.youtube.com/watch?v=8WNz86r5Sh4,2026-01-05,Unknown,Church Service,,75.0,Son Of Man Revealed Ministries,2026-01-05,available,
2023-05-28,Success,Adrian Gengan,The Great Church-Quake  Pastor Adrian Gengan  28-05-2023,https://www.youtube.com/watch?v=f4kDPm7frnk,2026-01-05,Unknown,Church Service,,86.0,Son Of Man Revealed Ministries,2026-01-05,available,
2023-05-25,Success,Unknown Speaker,Receiving and Producing the Word  Bro Joshua  24-05-2022,https://www.youtube.com/watch?v=bmhJ7M7Idis,2026-01-27,Unknown,Full Sermon,,0,Son Of Man Revealed Ministries,2026-01-27,available,
