date,status,speaker,title,url,last_checked,language,type,description,duration,church,first_scraped,video_status,video_removed_date
2025-08-09,Success,Adrian Gengan,How To Unlock God's Favour Over Your Life  Pastor Adrian Gengan  20-07-2025,https://www.youtube.com/watch?v=Dqfxzpdsca4,2026-01-05,Unknown,Church Service,,85.0,Son Of Man Revealed Ministries,2026-01-05,available,
2025-08-07,Success,God Provided Place of Worship  3 August 2025,The Season of The Headstone,https://www.youtube.com/watch?v=Xsx98k9d_1I,2026-01-15,Unknown,Full Sermon,,0.0,Son Of Man Revealed Ministries,2026-01-15,available,
2025-08-03,Success,Adrian Gengan,The KEY of David  The 2 Doors Of Ministry Opened To Queen Esher  Pastor Adrian Gengan  13 07 2025,https://www.youtube.com/watch?v=RC-IuAoWrdQ,2026-01-05,Unknown,Church Service,,74.0,Son Of Man Revealed Ministries,2026-01-05,available,
2025-06-07,Success,Revelation is the Key  Pastor Adrian Gengan  Sun AM 06-07-2025,JESUS is the Door,https://www.youtube.com/watch?v=m95Pzui6lhA,2026-01-15,Unknown,Full Sermon,,0.0,Son Of Man Revealed Ministries,2026-01-15,available,
2025-07-26,Success,Joshua Chetty,From a New Heart to God's Complete Work In You Bro Joshua Chetty,https://www.youtube.com/watch?v=kbF9vZTx4_Y,2026-01-05,Unknown,Church Service,,80.0,Son Of Man Revealed Ministries,2026-01-05,available,
2025-07-26,Success,Adrian Gengan,Wed PM Pastor Adrian Gengan,https://www.youtube.com/watch?v=0WWFLpypUCM,2026-01-05,Unknown,Church Service,,74.0,Son Of Man Revealed Ministries,2026-01-05,available,
2025-02-07,Success,Moses Dzvova,Declaration by Silence  Pastor Moses Dzvova {Zimbabwe}  02-07-2025,https://www.youtube.com/watch?v=8KMKnXaHfvU,2026-01-05,Unknown,Church Service,,135.0,Son Of Man Revealed Ministries,2026-01-05,available,
2025-07-14,Success,Adrian Gengan,Character Development for Divine Power  Pastor Adrian Gengan  25-06-2025,https://www.youtube.com/watch?v=ChgIz7avx3U,2026-01-05,Unknown,Church Service,,64.0,Son Of Man Revealed Ministries,2026-01-05,available,
2025-07-14,Success,Eschol Roberts,That Nothing May Be Lost  Pastor Eschol Roberts  29-06-2025,https://www.youtube.com/watch?v=a1civIvoVtY,2026-01-05,Unknown,Church Service,,95.0,Son Of Man Revealed Ministries,2026-01-05,available,
2025-07-14,Success,Pastor Adrian Gengan  22-06-2025,👑Crowning Our Ministry As Adopted Sons Of God  Divine Power,https://www.youtube.com/watch?v=RX3IH5b-8_U,2026-01-15,Unknown,Full Sermon,,0.0,Son Of Man Revealed Ministries,2026-01-15,available,
2025-07-12,Success,Bro Joshua Chetty,Called out to be Blessed,https://www.youtube.com/watch?v=hIieZ-TGwJ4,2026-01-15,Unknown,Full Sermon,,0.0,Son Of Man Revealed Ministries,2026-01-15,available,
2025-07-08,Success,Adrian Gengan,Fathers Day Message  Pastor Adrian Gengan  15-06-2025,https://www.youtube.com/watch?v=4JbQtbUDQx0,2026-01-05,Unknown,Church Service,,74.0,Son Of Man Revealed Ministries,2026-01-05,available,
2025-07-06,Success,Unknown Speaker,In Changing Seasons the Word is our Constant,https://www.youtube.com/watch?v=8vt4IF_1nqY,2026-01-05,Unknown,Short Clip,,49.0,Son Of Man Revealed Ministries,2026-01-05,available,
2025-06-29,Success,Johnathan Naidoo,The Future Home of The Heavenly Bridegroom and the Earthly Bride -Pastor Johnathan Naidoo,https://www.youtube.com/watch?v=uyfaZLCbzyI,2026-01-05,Unknown,Church Service,,95.0,Son Of Man Revealed Ministries,2026-01-05,available,
2025-06-25,Success,Brother Joshua Chetty,God Purges his Sons into Character  Power without Character is Satanic,https://www.youtube.com/watch?v=ho_dPovJBBY,2026-01-15,Unknown,Full Sermon,,0.0,Son Of Man Revealed Ministries,2026-01-15,available,
2025-06-18,Success,Adrian Gengan,The Holy Ghost Positioning Sons Of GOD for the Final Omega Manifestation  Pastor Adrian Gengan,https://www.youtube.com/watch?v=vA97L5x7XVw,2026-01-05,Unknown,Church Service,,71.0,Son Of Man Revealed Ministries,2026-01-05,available,
2025-06-17,Success,Adrian Gengan,👑Crowning Our Ministry As Adopted Sons Of God  Divine Character  10625  Pastor Adrian Gengan,https://www.youtube.com/watch?v=70F7fXguKTI,2026-01-05,Unknown,Church Service,,76.0,Son Of Man Revealed Ministries,2026-01-05,available,
2025-06-08,Success,Unknown Speaker,"The Thing which hath been, is that which shall be",https://www.youtube.com/watch?v=h8CyqFPzHLY,2026-01-05,Unknown,Church Service,,75.0,Son Of Man Revealed Ministries,2026-01-05,available,
2025-06-01,Success,Adrian Gengan,The Time Appointed of the Father  Pastor Adrian Gengan  21 May 2025,https://www.youtube.com/watch?v=M3LLgDtrK_s,2026-01-05,Unknown,Short Clip,,45.0,Son Of Man Revealed Ministries,2026-01-05,available,
2025-05-25,Success,Adrian Gengan,👑Crowning Our Ministry As Adopted Sons Of God  Divine Nature  Pastor Adrian Gengan 18 May 2025,https://www.youtube.com/watch?v=AG1kc38Xskg,2026-01-05,Unknown,Church Service,,79.0,Son Of Man Revealed Ministries,2026-01-05,available,
2025-05-21,Success,Adrian Gengan,🔴LIVE  A Chosen Generation With A Chance At The Word  Pastor Adrian Gengan  7 May 2025,https://www.youtube.com/watch?v=xkcN9_JPVGs,2026-01-05,Unknown,Short Clip,,51.0,Son Of Man Revealed Ministries,2026-01-05,available,
2025-05-18,Success,Adrian Gengan,NEW POPE USA  HAPPY MOTHER'S DAY MRS JESUS CHRIST  IMAGE OF GOD  Pastor Adrian Gengan 11 May 2025,https://www.youtube.com/watch?v=QTST3vlEoV4,2026-01-05,Unknown,Church Service,,82.0,Son Of Man Revealed Ministries,2026-01-05,available,
2025-05-14,Success,Japheth Chetty,The Kingdom  Bro Japheth Chetty   30-04-2025,https://www.youtube.com/watch?v=uQxLjf-yVFM,2026-01-05,Unknown,Church Service,,101.0,Son Of Man Revealed Ministries,2026-01-05,available,
2025-05-11,Success,Brother Joshua Chetty,Being Successful God's Way  Success is doing the Will of God,https://www.youtube.com/watch?v=NVTi8FLpU0I,2026-01-15,Unknown,Full Sermon,,0.0,Son Of Man Revealed Ministries,2026-01-15,available,
2025-05-05,Success,Adrian Gengan,The Taking Of The Book Gives The Redeemer Rights  Pastor Adrian Gengan  27-04-2025,https://www.youtube.com/watch?v=WAKx5FBdJEA,2026-01-05,Unknown,Church Service,,73.0,Son Of Man Revealed Ministries,2026-01-05,available,
2024-02-04,Success,Joshua Chetty,Understanding Roles & Responsibilities Of Sons Of God In This Hour  Bro Joshua Chetty  02-04-2024,https://www.youtube.com/watch?v=QN1lwZN_Lbo,2026-01-05,Unknown,Church Service,,77.0,Son Of Man Revealed Ministries,2026-01-05,available,
2025-09-04,Success,Unknown Speaker,Good & Bad Bacteria  Pastor Varam (India)  09-04-2025,https://www.youtube.com/watch?v=ZTZoEMcw158,2026-01-27,Unknown,Full Sermon,,0,Son Of Man Revealed Ministries,2026-01-27,available,
2025-04-24,Success,Dele Adelodun,The Purpose of GOD  Pastor Dele Adelodun (Nigeria)  23-04-2025  IN MEMORY OF PASTOR RONNIE GENGAN,https://www.youtube.com/watch?v=Zla-WJkDXr4,2026-01-27,Unknown,Full Sermon,,0,Son Of Man Revealed Ministries,2026-01-27,available,
2025-04-22,Success,Dele Adelodun,Sun PM🔴 LIVE  Rev. Dele Adelodun (Nigeria)  Easter Convention 2025  20-04-2025,https://www.youtube.com/watch?v=v21j4MRyl44,2026-01-05,Unknown,Easter Program,,169.0,Son Of Man Revealed Ministries,2026-01-05,available,
2025-04-21,Success,Dele Adelodun,Sun AM🔴 LIVE  Rev. Dele Adelodun (Nigeria)  Easter Convention 2025  20-04-2025,https://www.youtube.com/watch?v=pNGRtNo6TG0,2026-01-05,Unknown,Easter Program,,193.0,Son Of Man Revealed Ministries,2026-01-05,available,
2025-04-19,Success,Dele Adelodun,Sat PM🔴 LIVE  Rev. Dele Adelodun (Nigeria)  Easter Convention 2025  19-04-2025,https://www.youtube.com/watch?v=5jGJqKyyxDU,2026-01-05,Unknown,Easter Program,,159.0,Son Of Man Revealed Ministries,2026-01-05,available,
2025-04-19,Success,Dele Adelodun,Fri PM🔴 LIVE  Rev. Dele Adelodun (Nigeria)  Easter Convention 2025  18-04-2025,https://www.youtube.com/watch?v=YdTrj82Md8Q,2026-01-05,Unknown,Easter Program,,139.0,Son Of Man Revealed Ministries,2026-01-05,available,
2025-04-19,Success,Dele Adelodun,Fri AM🔴 LIVE  Rev. Dele Adelodun (Nigeria)  Easter Convention 2025  18-04-2025,https://www.youtube.com/watch?v=08DpAAmniTs,2026-01-05,Unknown,Easter Program,,177.0,Son Of Man Revealed Ministries,2026-01-05,available,
2025-04-18,Success,Adrian Gengan,I GIVE IT TO YOU🔥  Pastor Adrian Gengan  30-03-2025 🔴 LIVE,https://www.youtube.com/watch?v=RSZu_pqtPvA,2026-01-05,Unknown,Church Service,,78.0,Son Of Man Revealed Ministries,2026-01-05,available,
2025-04-06,Success,Joel Basdeo,Brother Joel Basdeo (Guyana)  26-03-2025,https://www.youtube.com/watch?v=7vjcMbtgsR8,2026-01-05,Unknown,Church Service,,113.0,Son Of Man Revealed Ministries,2026-01-05,available,
2025-03-22,Success,Joshua Chetty,Brother Joshua Chetty  16-03-2025,https://www.youtube.com/watch?v=zwnen_OoqQo,2026-01-05,Unknown,Church Service,,73.0,Son Of Man Revealed Ministries,2026-01-05,available,
2025-03-18,Success,William M. Branham,Exposing The Rider of The First Seal  William Marrion Branham,https://www.youtube.com/watch?v=-HSpO1RCGoY,2026-01-27,Unknown,Full Sermon,,0,Son Of Man Revealed Ministries,2026-01-27,available,
2025-03-17,Success,William M. Branham,"God Hiding Himself In Simplicity, Then Revealing Himself In The Same  William Marrion Branham",https://www.youtube.com/watch?v=8V5kb_CLZgo,2026-01-27,Unknown,Full Sermon,,0,Son Of Man Revealed Ministries,2026-01-27,available,
2025-03-16,Success,Adrian Gengan,And I Took The Little Book  The Authority and Power In The SHOUT  Pastor Adrian Gengan  09-03-25,https://www.youtube.com/watch?v=NWUvqQZsLi8,2026-01-05,Unknown,Church Service,,113.0,Son Of Man Revealed Ministries,2026-01-05,available,
2025-05-03,Success,Adrian Gengan,The Abstract Title Deed Are For Adopted Sons  Pastor Adrian Gengan  05-03-2025,https://www.youtube.com/watch?v=IF1FfMfItA0,2026-01-05,Unknown,Short Clip,,57.0,Son Of Man Revealed Ministries,2026-01-05,available,
2025-02-03,Success,Adopted Sons Fulfilling The Promise  Pastor Adrian Gengan  02-03-2025,Changing of Masks,https://www.youtube.com/watch?v=GL-SvhAPMAE,2026-01-15,Unknown,Full Sermon,,0.0,Son Of Man Revealed Ministries,2026-01-15,available,
2025-02-27,Success,Joshua Chetty,The Marriage of the Lamb and the Bride’s Responsibility  Brother Joshua Chetty  23-02-2025,https://www.youtube.com/watch?v=z3ipFrUM3sw,2026-01-05,Unknown,Church Service,,88.0,Son Of Man Revealed Ministries,2026-01-05,available,
2025-02-26,Success,Joshua Chetty,Pressing Toward the Mark – The Bride’s High Calling in Christ Brother Joshua Chetty  19-02-2025,https://www.youtube.com/watch?v=fLxtqNMVuMY,2026-01-05,Unknown,Church Service,,61.0,Son Of Man Revealed Ministries,2026-01-05,available,
2025-02-18,Success,Adrian Gengan,Through Revelation We Obtain The Promise & Defeat Satan’s Kingdom Pastor Adrian Gengan  16-02-2025,https://www.youtube.com/watch?v=sBnjtFR1i5I,2026-01-05,Unknown,Church Service,,75.0,Son Of Man Revealed Ministries,2026-01-05,available,
2025-09-02,Success,Joshua Chetty,Revelation 13 & America in the Last Days  Bro Joshua Chetty  09-02-2025,https://www.youtube.com/watch?v=0r5exgeOdwM,2026-01-05,Unknown,Church Service,,93.0,Son Of Man Revealed Ministries,2026-01-05,available,
2025-12-01,Success,The Time Of Fulfilled Promise  12-01-2025,After 25 years,https://www.youtube.com/watch?v=NnWHsTDX1yo,2026-01-15,Unknown,Full Sermon,,0.0,Son Of Man Revealed Ministries,2026-01-15,available,
2025-02-15,Success,Japheth Chetty,Living & Walking in the Brides vision  Bro Japheth Chetty  29-01-2025,https://www.youtube.com/watch?v=3nYGlQCvKKo,2026-01-05,Unknown,Church Service,,74.0,Son Of Man Revealed Ministries,2026-01-05,available,
2025-02-02,Success,Adrian Gengan,5x5 Multiplication Of Grace  The Bride Is Perfected & Married  Pastor Adrian Gengan  02-02-2025,https://www.youtube.com/watch?v=nYCLHF9yxeA,2026-01-05,Unknown,Church Service,,74.0,Son Of Man Revealed Ministries,2026-01-05,available,
2025-01-27,Success,Grace Meets Perfection  Pastor Adrian Gengan  27-01-2025 William Branham,After 25 years,https://www.youtube.com/watch?v=rQ1o2H594DM,2026-01-15,Unknown,Full Sermon,,0.0,Son Of Man Revealed Ministries,2026-01-15,available,
2025-01-25,Success,Adrian Gengan,A Spiritually Successful Man of Vision  Pastor Adrian Gengan  22-01-2025,https://www.youtube.com/watch?v=qX97V9EARN4,2026-01-05,Unknown,Short Clip,,56.0,Son Of Man Revealed Ministries,2026-01-05,available,
2025-01-20,Success,Joshua Chetty,God’s Watchman In The End Times  Brother Joshua Chetty  19-01-2025,https://www.youtube.com/watch?v=-matEBWj-JE,2026-01-05,Unknown,Church Service,,85.0,Son Of Man Revealed Ministries,2026-01-05,available,
2025-01-18,Success,Adrian Gengan,Are We Able To Discern The Signs Of The Time Like William Branham  Pst Adrian Gengan  15-01-2025,https://www.youtube.com/watch?v=Me1QnuNiTSI,2026-01-05,Unknown,Church Service,,65.0,Son Of Man Revealed Ministries,2026-01-05,available,
2025-05-01,Success,Adrian Gengan,"Expectations, Visions and Declarations For You in 2025  Pastor Adrian Gengan  05-01-2025",https://www.youtube.com/watch?v=VnxdvS9Hcds,2026-01-05,Unknown,Church Service,,66.0,Son Of Man Revealed Ministries,2026-01-05,available,
2025-01-04,No Transcript,Adrian Gengan,The Opening Of Dimensional Doors | Pastor Adrian Gengan | 31-12-2024 (Watch Night Service),https://www.youtube.com/watch?v=3BNo9b35kog,2026-01-05,Unknown,Church Service,,128.0,Son Of Man Revealed Ministries,2026-01-05,available,
2025-01-04,Success,Adrian Gengan,Our Christmas Gift The Word Of God Made Flesh In Us  Pastor Adrian Gengan  22-12-2024,https://www.youtube.com/watch?v=800W01y6AtE,2026-01-05,Unknown,Christmas Program,,99.0,Son Of Man Revealed Ministries,2026-01-05,available,
2024-12-31,Success,Joshua Chetty,Christ In Bride Form The Word Made Flesh Once More  Bro Joshua Chetty  29-12-2024,https://www.youtube.com/watch?v=VfchyoQxL6g,2026-01-05,Unknown,Church Service,,89.0,Son Of Man Revealed Ministries,2026-01-05,available,
2024-12-21,Success,Adrian Gengan,The Holy Ghost Seed In The Bride  Pastor Adrian Gengan  15-12-2024,https://www.youtube.com/watch?v=lTXiE-qOuWk,2026-01-05,Unknown,Short Clip,,59.0,Son Of Man Revealed Ministries,2026-01-05,available,
2024-01-12,Success,Adrian Gengan,The Bride's Jubilee Trumpet In The Days Of Our Prophecy  Pastor Adrian Gengan  01122024,https://www.youtube.com/watch?v=aDN0tndMurw,2026-01-05,Unknown,Church Service,,65.0,Son Of Man Revealed Ministries,2026-01-05,available,
2024-12-01,Success,Adrian Gengan,The Greatest & Most Powerful Force in Heaven & Earth  Pastor Adrian Gengan  24-11-2024,https://www.youtube.com/watch?v=gp4SVNVmlIo,2026-01-05,Unknown,Church Service,,68.0,Son Of Man Revealed Ministries,2026-01-05,available,
2024-11-30,Success,Joshua Chetty,The Bride Ministering in Love & Power  Brother Joshua Chetty  17-11-2024,https://www.youtube.com/watch?v=wC04lrRHLng,2026-01-05,Unknown,Church Service,,84.0,Son Of Man Revealed Ministries,2026-01-05,available,
2024-11-27,Success,Adrian Gengan,Your Identity Releases Your Authority  Pastor Adrian Gengan  13-11-2024,https://www.youtube.com/watch?v=Bac32KtwcsA,2026-01-05,Unknown,Short Clip,,44.0,Son Of Man Revealed Ministries,2026-01-05,available,
2024-10-11,Success,John & Peter  Pastor Adrian Gengan  10-11-2024,Love Produces Faith,https://www.youtube.com/watch?v=T-ThteHGRk8,2026-01-15,Unknown,Full Sermon,,0.0,Son Of Man Revealed Ministries,2026-01-15,available,
2024-06-11,Success,Adrian Gengan,God's Glorious Holy Ghost Filled Church  Pastor Adrian Gengan  06-11-2024,https://www.youtube.com/watch?v=MqmnvOL_ePo,2026-01-05,Unknown,Short Clip,,45.0,Son Of Man Revealed Ministries,2026-01-05,available,
2024-03-11,Success,"Peter, James & John  Pastor Adrian Gengan  03-11-2024","Faith, Hope & Charity",https://www.youtube.com/watch?v=_g3P3Vb-oYU,2026-01-15,Unknown,Full Sermon,,0.0,Son Of Man Revealed Ministries,2026-01-15,available,
2024-11-02,Success,Faith Hope & Charity -The Essence Of Love  Pst Adrian Gengan  27-10-24,A Three Dimensional Being,https://www.youtube.com/watch?v=v0aTE5MqY3o,2026-01-15,Unknown,Full Sermon,,0.0,Son Of Man Revealed Ministries,2026-01-15,available,
2024-10-30,Success,Joshua Chetty,Brother Joshua Chetty  23-10-2024,https://www.youtube.com/watch?v=F_xPZEKE1CU,2026-01-05,Unknown,Church Service,,64.0,Son Of Man Revealed Ministries,2026-01-05,available,
2024-10-30,Success,Japheth Chetty,Pressing till the breakthrough  Bro Japheth Chetty  17-10-2024,https://www.youtube.com/watch?v=G-bHxQfhYeo,2026-01-05,Unknown,Short Clip,,55.0,Son Of Man Revealed Ministries,2026-01-05,available,
2024-10-27,Success,The Holy Ghost Is Raising A Standard  Pastor Adrian Gengan  20-10-2024,Nissi,https://www.youtube.com/watch?v=aA2LYi1JlhM,2026-01-15,Unknown,Full Sermon,,0.0,Son Of Man Revealed Ministries,2026-01-15,available,
2024-10-20,Success,Adrian Gengan,The Glory Of The Bride Is Becoming More Radiant  Pastor Adrian Gengan  13-10-2024,https://www.youtube.com/watch?v=5YrR7BoYcwQ,2026-01-05,Unknown,Church Service,,74.0,Son Of Man Revealed Ministries,2026-01-05,available,
2024-02-10,Success,Joshua Chetty,Positionally placed to overcome  Bro Joshua Chetty  02-10-2024,https://www.youtube.com/watch?v=dGh4k1vzLrA,2026-01-05,Unknown,Short Clip,,58.0,Son Of Man Revealed Ministries,2026-01-05,available,
2024-09-10,No Transcript,Adrian Gengan,Faith that can be seen | Pastor Adrian Gengan | 09-10-2024,https://www.youtube.com/watch?v=n4h87O2kuCY,2026-01-05,Unknown,Short Clip,,40.0,Son Of Man Revealed Ministries,2026-01-05,available,
2024-09-29,Success,Adrian Gengan,The Seals Were Open For Sons To Come To Manifestation  22-09-2024  Pastor Adrian Gengan,https://www.youtube.com/watch?v=KlCYaKyTZSQ,2026-01-05,Unknown,Church Service,,81.0,Son Of Man Revealed Ministries,2026-01-05,available,
2024-09-26,Success,William M. Branham,The Faith Of A Heart Turned By The Prophet William Branham  18-02-2024  Pastor Adrian Gengan,https://www.youtube.com/watch?v=fMS8LKljVRY,2026-01-05,Unknown,Tape Service,,46.0,Son Of Man Revealed Ministries,2026-01-05,available,
2024-09-23,Success,Joshua Chetty,The Mouthpiece Of Painted Face Jezebel  Bro Joshua Chetty  15-09-2024,https://www.youtube.com/watch?v=SBnytEnlgEg,2026-01-05,Unknown,Church Service,,94.0,Son Of Man Revealed Ministries,2026-01-05,available,
2024-11-09,Success,Japheth Chetty,Spiritual Warfare; Instructions from the Captain of the Host Bro Japheth Chetty  11-09-2024,https://www.youtube.com/watch?v=FyJ-DDdCko0,2026-01-05,Unknown,Church Service,,76.0,Son Of Man Revealed Ministries,2026-01-05,available,
2024-08-09,Success,Adrian Gengan,The Philidelphia Corridor  Three War Goals  Pastor Adrian Gengan  08-09-2024,https://www.youtube.com/watch?v=X8NzXr_yOvI,2026-01-05,Unknown,Church Service,,77.0,Son Of Man Revealed Ministries,2026-01-05,available,
2024-01-09,Success,Adrian Gengan,Utterly Slay And Destroy The Enemy By Your Word Seed  Pastor Adrian Gengan  01092024,https://www.youtube.com/watch?v=CBlptGU0AnI,2026-01-05,Unknown,Church Service,,100.0,Son Of Man Revealed Ministries,2026-01-05,available,
2024-09-07,Success,Adrian Gengan,Strengthening Our Borders  Pastor Adrian Gengan  28-08-2024,https://www.youtube.com/watch?v=M07CC5M4yTE,2026-01-05,Unknown,Church Service,,66.0,Son Of Man Revealed Ministries,2026-01-05,available,
2024-04-09,Success,Adrian Gengan,The Mighty Angel Is Here In Our Time Of Trouble  Pastor Adrian Gengan  04-09-2024,https://www.youtube.com/watch?v=hA4UneA520A,2026-01-05,Unknown,Short Clip,,44.0,Son Of Man Revealed Ministries,2026-01-05,available,
2024-08-29,Success,Joshua Chetty,Enlarging Boundaries and Extending Spiritual Territories  Brother Joshua Chetty  21-08-2024 (PM),https://www.youtube.com/watch?v=MGGew7SLKUQ,2026-01-05,Unknown,Church Service,,71.0,Son Of Man Revealed Ministries,2026-01-05,available,
2024-08-25,Success,Adrian Gengan,Our Strategic Alliance with the Unseen world  Pst Adrian Gengan  25-08-2024,https://www.youtube.com/watch?v=jEt6WgkUeNI,2026-01-05,Unknown,Church Service,,94.0,Son Of Man Revealed Ministries,2026-01-05,available,
2024-08-25,Success,Enlarging Territories  Pastor Adrian Gengan  14-08-2024 (PM),The Opening of Spiritual Frontiers,https://www.youtube.com/watch?v=CFfQ2ldPiL8,2026-01-15,Unknown,Full Sermon,,0.0,Son Of Man Revealed Ministries,2026-01-15,available,
2024-08-25,Success,Adrian Gengan,The Opening Of Spiritual Frontiers  Pastor Adrian Gengan  18-08-2024,https://www.youtube.com/watch?v=2B5HLaNMF1M,2026-01-05,Unknown,Church Service,,81.0,Son Of Man Revealed Ministries,2026-01-05,available,
2024-11-08,Success,The Syllabus for Adoption  Pastor Adrian Gengan  11-08-2024,C.O.D,https://www.youtube.com/watch?v=B_zwJxwQWfU,2026-01-15,Unknown,Full Sermon,,0.0,Son Of Man Revealed Ministries,2026-01-15,available,
2024-04-08,Success,Joshua Chetty,Understanding The Purpose Of The Prophet & Seeing The Promise Coming To Pass  Bro Joshua Chetty,https://www.youtube.com/watch?v=qgZNlx2vYKs,2026-01-05,Unknown,Church Service,,78.0,Son Of Man Revealed Ministries,2026-01-05,available,
2024-08-06,Success,Adrian Gengan,God Still Has Anointed David's  Pastor Adrian Gengan  Wed PM 31-07-2024,https://www.youtube.com/watch?v=4vmOwuY2jWI,2026-01-05,Unknown,Church Service,,74.0,Son Of Man Revealed Ministries,2026-01-05,available,
2024-08-05,Success,Adrian Gengan,The Gates Of Heaven VS The Gates of Hell  Pastor Adrian Gengan  WED PM 24-07-2024,https://www.youtube.com/watch?v=vfGiU5lKjtQ,2026-01-05,Unknown,Church Service,,76.0,Son Of Man Revealed Ministries,2026-01-05,available,
2024-07-28,Success,Adrian Gengan,Scriptural Sign Regarding Trump's Ear  The Armour Of Adopted Sons  Pastor Adrian Gengan  21-07-24,https://www.youtube.com/watch?v=9BUxun1OhXQ,2026-01-05,Unknown,Church Service,,61.0,Son Of Man Revealed Ministries,2026-01-05,available,
2024-07-26,Success,Adrian Gengan,The Dangers of Remaining A Son  Growing Up From Being Born Again to Adoption  Pastor Adrian Gengan,https://www.youtube.com/watch?v=I_rLhVh8iyI,2026-01-05,Unknown,Church Service,,66.0,Son Of Man Revealed Ministries,2026-01-05,available,
2024-07-15,Success,Joshua Chetty,The Responsibility Of Being Positionally Placed  Bro Joshua Chetty  14-07-2024 Sun Am,https://www.youtube.com/watch?v=5SXMPYVuNts,2026-01-05,Unknown,Church Service,,79.0,Son Of Man Revealed Ministries,2026-01-05,available,
2024-07-07,Success,Adrian Gengan,Glimpses Of The god Man  Pastor Adrian Gengan  07-07-2024 Sun Am,https://www.youtube.com/watch?v=0_Aoyvo13dU,2026-01-05,Unknown,Church Service,,95.0,Son Of Man Revealed Ministries,2026-01-05,available,
2024-07-04,Success,Joshua Chetty,Manifestation Of The Prophesied Promise Coming To Pass  Bro Joshua Chetty  26-06-2024,https://www.youtube.com/watch?v=SEbnf7eDoC4,2026-01-05,Unknown,Church Service,,79.0,Son Of Man Revealed Ministries,2026-01-05,available,
2024-06-26,Success,Kings and Priests  Pastor Adrian Gengan  23-06-2024,The Image of God,https://www.youtube.com/watch?v=FRzk70ivxfY,2026-01-15,Unknown,Full Sermon,,0.0,Son Of Man Revealed Ministries,2026-01-15,available,
2024-06-20,Success,Moses Dzvova,The Vindicated Light Of This Day  Pastor Moses Dzvova {Zimbabwe}  19-06-2024,https://www.youtube.com/watch?v=okmYHj8QcHg,2026-01-05,Unknown,Church Service,,97.0,Son Of Man Revealed Ministries,2026-01-05,available,
2024-06-20,Success,Joshua Chetty,Moving Into Position For Translation  Bro. Joshua Chetty  26-05-2024,https://www.youtube.com/watch?v=vga22_ZmfiM,2026-01-05,Unknown,Church Service,,99.0,Son Of Man Revealed Ministries,2026-01-05,available,
2024-05-24,Success,Japheth Chetty,The Final Vindication Of William Branham's Message  Bro Japheth Chetty  15-05-2024,https://www.youtube.com/watch?v=3kuOOaRO_PU,2026-01-05,Unknown,Church Service,,89.0,Son Of Man Revealed Ministries,2026-01-05,available,
2024-05-24,Success,Adrian Gengan,"Let Me Introduce You To John, A Type of the Bride  Pastor Adrian Gengan  19-05-24",https://www.youtube.com/watch?v=Og3-HEljFns,2026-01-05,Unknown,Church Service,,96.0,Son Of Man Revealed Ministries,2026-01-05,available,
2024-05-19,Success,Adrian Gengan,{Mother's Day 2024} Redemption of Man Through Motherhood {Sarah-Mary-The Bride} Pastor Adrian Gengan,https://www.youtube.com/watch?v=ua8BNKqB9eg,2026-01-05,Unknown,Church Service,,95.0,Son Of Man Revealed Ministries,2026-01-05,available,
2024-05-15,Success,Joshua Chetty,Abiding In The Vine The Bride Is A Fruitful Branch  Bro Joshua Chetty  14-05-2024,https://www.youtube.com/watch?v=08pQTSWg5RU,2026-01-05,Unknown,Church Service,,91.0,Son Of Man Revealed Ministries,2026-01-05,available,
2024-05-11,Success,Unknown Speaker,William Branham Is Comissioned By The Angel Of The Lord @ 37 Years Old,https://www.youtube.com/watch?v=G77dXxCy4Kg,2026-01-05,Unknown,Short Clip,,4.0,Son Of Man Revealed Ministries,2026-01-05,available,
2024-05-06,Success,Adrian Gengan,The Shekinah Glory Over Your Seed Word To Bring You To A Manifested Son  Pst Adrian Gengan 5-05-24,https://www.youtube.com/watch?v=fX_bynrqLsM,2026-01-05,Unknown,Church Service,,84.0,Son Of Man Revealed Ministries,2026-01-05,available,
2024-01-05,Success,Adrian Gengan,The Life Behind That Name  Pastor Adrian Gengan  01-05-2024,https://www.youtube.com/watch?v=jYc935lPGzE,2026-01-05,Unknown,Church Service,,85.0,Son Of Man Revealed Ministries,2026-01-05,available,
2024-04-29,No Transcript,William M. Branham,#song - I'm In That Number - New Verse - Brother Branham Saw Me In That Vision,https://www.youtube.com/watch?v=Me9JJYEAIuo,2026-01-05,Unknown,Tape Service,@WilliamMarrionBranham_EN  @WilliamBranhamHindi @WilliamMarrionBranhamMessages @LePropheteMalachie4,2.0,Son Of Man Revealed Ministries,2026-01-05,available,
2024-04-29,Success,Unknown Speaker,song Justified + 3 added verses (Formed Word Image of Christ),https://www.youtube.com/watch?v=eI-nmiHqY3U,2026-01-27,Unknown,Full Sermon,,0,Son Of Man Revealed Ministries,2026-01-27,available,
